passage.number,passage,annotator,nondomestic,notes
727,"James responded in a con- ciliatory tone. "" But since we must converse on a painful matter, and as you do not entertain any friendly feeling to me, let us exercise self-control and forbear from irritating altercation. Of course I know what it is you wish to speak to me about. You need not trouble yourself to introduce the subject/'' "" But I will introduce the subject/' Hercules Kingsford responded fiercely. "" You may shrink from hearing all the misery that you have brought upon me and my wife : but I am no coward to shrink from recounting the humiliation with which your vindictive conspiracy has covered a man who was your friend, — yes, and Fll say it, if only that I may cancel the debt of gratitude you owe me and my family, — your benefactor. You shall hear me."" "" I am listening.""",alex,,
732,"With your permission,"" concerning the seat he took, and that "" a draught of morn- ing air would do him good."" Then he laughed politely, exchanged wavy distant farewells with his comrades, touched a breast-pocket for his case of cigars, pulled forth one, obtained "" the loan of a light,'' blew clouds and fell into the anticipated composure^ quite understanding the case and his office. Both agreed as to the fine morning it was. Woodseer briefly assented to his keeper's reiterated encomium on the morning, justified on oath. A fine morning, indeed. '^ Damned if I think I ever saw so fine a morning ! "" Potts cried.",alex,,
737,"Though he had all along confidently looked forward to success, it quite took his breath away to find that every obstacle had vanished. The past had become an ugly dream, but it was difficult to escape from its influence in a moment. Gaunt gone and the Doctor released from his troubles — that was surely something to be thankful for. And now Nellie was really to be his ! The castles they had built together rose before his dazzled eyes, and his cheeks glowed as he gazed upon them. Suddenly he sprang up and went across to Sterne. '' I owe my happiness to yon,"" he said. ^'",alex,,
742,"Cherbury was a magie name with her. She loved Lady Annabel, and she loved you, Venetia. It ran in the blood, you see. She would be happy, quite happy, if she saw us all here together, and if she knew ' 'Plantagenet,' said Lady Annabel, 'you must build a lodge at this end of tho park. I cannot conceive anythino more effective than an entrance from the Southport road in this quarter.' ' Certainly, Lady Annabel, certainly wc must build a lodge. Do not you think so, Venetia ?",alex,,
747,"These fragrant beauties are the chief rewards the considerate pro- phet bestows on his obedient worshippers, to whom he has bequeathed this most con- soling volume. Month after month hostilities continued, without any apparent prospect of an ap- proach to a conclusion. Eeports were rife, that some mortars were coming from some quarter for the use of the besiegers, but no such effective pieces of ordnance ever ap- peared, and we grew weary of the con- tinuance of what at first had greatly excited us. Though forbidden to manifest any open preference for their favourites, "" the outside party,"" the mids could not always resist the temptation held out to them to enter the forts, and fire a shot or two at any conspicuous object on the walls of the town, especially if it looked like a French ofiicer from the corvette in the harbour, which certainly favoured the be- sieged. Upon one occasion, a gang of us were thus employed as amateur artillerists, when a succession of well-directed shot from the foe admonished us of our imprudence, and nearly smothered us with the sand thrown up around. Having a strong opinion of the force and efficacy of example, we did not immediately decamp, but dis- charged every gun at our command with some effect, much to the delight of the applauding Arabs, who waved their bur- nooses, and shouted forth defiance. After this we departed, not quite sure of being overburdened with sense.",alex,,
