passage.number,passage,annotator
5,"Although Miss Biddy was daily pestered with accusations against her knavish ward, she determined not to credit a word to his dispa- ragement, especially as these were accusations not substantiated by evidence, which they could not well be, for he had never yet been actually and substantively detected in a viola- tion of the criminal code. He therefore pur- sued his career with the greater recklessness, whilst the idea of an absolute predestination to eternal life had so fixed upon his conviction, that he claimed to himself impunity from sin as a matter of divine and indefeasible privilege. Impelled by the confidence which such a con- clusion naturally awakened, he cast himself into all sorts of peril without once looking to the issue ; and to Erasmus's question in the colloquy of the soldier's confession, "" Do you never think what will become of your soul if you are knocked on the head ?"" he would no doubt have exclaimed with the murderous thane — "" I bear a charmed life !""* The venerable Miss Mackinnon, who had now attained a period of most respectable senility — for she was by this time fast verging upon seventy — though she became at times excessively peevish when the tricks of her ward were made the topic of discourse, dog- gedly adhered to her old conclusion that a pre- * Macbeth. destinated sinner must make an elected saint ; and, therefore, no matter to her how the dogs of the world, who had "" neither part nor lot'^ with him , represented his backslidings, she felt satisfied nevertheless, that he was perfectly secure of a communion with Calvin in the world of beati- fied spirits, where he would exult over the fall of Arminius and his three able defenders, Barnevelt, Grotius, and Hoogarbetz_, whom the Oudewater heretic had seduced from the sim- plicity of the truth, and involved in that ever- lasting doom which he had brought down upon himself.",matt
10,"He used to carry hemp to be steeped in the Lago d'Aniano, a very dangerous employ- ment, which annually cuts oft' many of the natives; the vicinity of the lake being rendered unhealthy by the malaria, in consequence of the fermentative process undergone in tlie The monk who watched over him was the Padre Antonio, who shortly after became ab- bot of that community. It was then to him that Augustin suggested their addressing them- selves. He had his reasons for thinking that Father Antonio would not refuse him, and he was deputed to confer with him . They then ascended the steep, and winding rocky road which led to the monastery. As they drew near to it, the voices of the monks rose in solemn chant for the midnight service ; and the sound rolled in harmonious diapasons past the startled ears of the ruffians, who formed themselves in a circle round the con- vent ; it havino- been decided, that if they failed in their request to the abbot, tliey sliould re- venge themselves immediately by destroying the convent, and murdering the monks.",matt
15,"Is it Carruthers ? "" asked Horace, after a pause. '' Dela cares for some one, I'm sure."" ""No, it is not his lordship,"" replied Lilian sadly. "" I wish she could like him, he would make her a loving husband,, and he w^orships her."" "" I have thouo^ht so for a lono- time. Well, who is it, Lilian ?",matt
20,"A VERY HANDSOME VOLUME- Large 410, cloth extra, 31J. 6d. White Mountains (The Heart of the) : Their Legend and Scenery. By Samuel Adams Drake. With nearly 100 Illustrations by W. Hamilton Gibson, Author of "" Pastoral Days."" Crown 8vo, cloth limp, with Illustrations, 2j.",matt
25,"And now there came to them from Mr. Emilius the prettiest little gold salver that ever was seen. “I send Messrs. Clerico's docket,” wrote Mr. Emilius, “as Miss Roanoke may like to know the quality of the metal.” “Ah,” said Mrs. Carbuncle inspecting the little dish, and putting two and two together; “he's got it cheap, no doubt,— at the place where they commissioned him to buy the plate and candlesticks for the church; but at £3 16s. 3d. the gold is worth nearly twenty pounds.” Mr.",matt
30,"There was something incongruous and inconceivable in the idea of the child of Cornelia a woman, married to his cousin. He feared to see in her an image of the being who had subdued his heart of hearts, and laid prostrate his whole soul; he trembled to catch the sound of her voice, lest it might echo tones which could disturb to their depths his inmost thoughts. Ethel was so unlike her mother, that by degrees he became reassured; her eyes, her hair, her stature, and tall slender shape, were the reverse of Lady Lodore; so that in a little while he ventured to raise his eyes to her face, and to listen to her, without being preoccupied by a painful sensation, which, in its violence, resembled terror. It is true that by degrees this dissimilarity to her mother became less; she had gestures, smiles, and tones, that were all Lady Lodore, and which, when discerned, struck his heart with a pang, stealing away his voice, and causing him to stand suspended in the act he was about, like one acted upon by magic. While this mute and curious examination was going on in the minds of Ethel and her visitant, the conversation had not tarried. Edward had never been so far south, and the wonders of Naples were as new to him as to Ethel. Saville was eager to show them, and proposed going that very day to Pompeii.",matt
35,"Nogo shot uncommonly well, so that the grey-hen hadn't a chance."" "" It was my first appearance,"" I modestly suggested, "" and I could not be expected to be steady froQi riot."" "" Never mind,"" said Beeswing, alluding to an old story of poor Goosey, when ' a gent ' rode on to one of his hounds and killed him ; "" it's a poor concern that can't afford one a- day. Put the wdiisky-flask into the spring to cool. Sandy, get me a game-bag to sit upon. Now then, caterer Cob, what have you pro- vided for luncheon ?""",matt
40,"The poison of asps is under their lips, sir. I've proved it.' But there certainly was a tendency on the part of some to indulge in ungenerous criticisms concerning their neighbour's doings. Indeed, the atmosphere of Peckmore's seemed to have quite an alterative effect upon many of its patrons. Robert made the acquaintance of some, to all appearances, delightful people outside, who developed the most unexpected capabilities for maliciousness when once fairly in- stalled within. The disease took a dangerous form ; for whilst ignoring their own frailties, the patients im- puted the most selfish, discreditable motives to others. This certainly was a most singular phenomenon, and, not without alarm, did Robert contemplate how easily one could fall under the mysterious thraldom.",matt
45,"Toll's toll, I know that, and the miller has his dues as well as the farmer ; Ijut there's such a thing as paying through the nose, and that ril not do for the best grinding, by Saint-Corintin, will not I ! "" Poor Maitre Rannau. This was a heavy accusation, and almost took away his power of speech. Justify himself he did in a fashion ; promised to have his weig-hts adjusted immediately, made compensation from his own toll-bin, beg-g-ed a thousand pardons, and profoundly bowed the half-pacified farmer off tlie premises. Rut this did not conceal an ugly fact, nor clear up an awkward suspicion. In a tumult of agitation he went to seek for his much- praised man, who had not been present at the lodging ot this g-rave complaint. ""Holy Saint-Martin, what shall I do?"" he ejaculated under his breath, as he dragged his stiff leg- up the ladder which led to the grinding-room. """,matt
50,"Crown 8vo, cloth extra, 3s. 6d. ; post 8vo, illustrated boards, 2s. Lost Rose, and other Stories. Crown Svo, cloth extra, 3s. 6d. ; post Svo, illustrated boards, 2s. Mallory's (Sir Thomas) Mort d'Arthur : The Stories of King Arthur and of the Knights of the Round Table.",matt
55,"Discourse on Prophesy, p. 134. the patriarchal worship the visible mark of circum- cision, as a seal of a covenant between himself and Abraham. *' Yet how fit soever such a visible mark might be, to keep in remembrance the covenant between God and the family of Abraham, it was found in ex- perience, insufficient to preserve them from the idolatrous customs of their neighbours. Some new laws, some further constitutions of worship were to be added, or, as the family of Abraham were situated in the midst of idolators and unrighteous ones, it was foreseen they would soon fall from the essen- tials of religion ; and instead of preserving a right knowledge of God, of his being, perfections and go- vernment, a just sense of the reverence all men owe to him, from a firm belief of his being, power, domi- nion, justice, and goodness, and an hearty concern to obey the known will of God in all things ; doing what is pleasing in his sight, seeking, and hoping their perfection and happiness, in the likeness, and in the image of God ; they would, on the contrary, serve other Gods, and make their idolatry, not a matter of harmless speculation, but a fountain of the most dangerous immoralities ; and therefore, as it was highly fit in itself, and well becoming the wisdom of God, he gave Moses a Christianity in hieroglyphics, that is, a tabernacle, a shechinah, a priesthood, an altar, sacrifices, laws moral, and cere- monial, with every constituent part of the Hebrew ritual; being figures of a better shecbinah, temple, priest, altar, sacrifice, revelation, and blessings — figurative representations of the more perfect consti- tutions in the days of Messiah the King. This was in the year 875 after the flood, and in 1491 before Christ. By a ritual so becoming the wisdom of God, given for a preservative against idolatrous princi- ples, and as a dispensation preparatory to that future heavenly religion, the Hebrew nation were guarded against the surrounding corruptions of the world, and raised up the defenders of true religion, to pre- serve the knowledge and worship of the one true God. *'",matt
60,"I WISH MYSELF BACK AT CHICAGO . . . ... 82 CHAPTER Y, But a geeat Change comes over "" the Hut,"" and I AM GLAD I left ChICAGO 96 CHAPTER VI. A Strange Discovery 114 3Part IrM. CHAPTER T. In the Shadow of a Crime 120 CHAPTER 11. On a Sea of Doubt and Wonder .... 130 CHAPTER III. ""Which proves the Truth of the Adage that you GO from Home to hear News . . . .140 CHAPTER IV.",matt
65,"That is impossible,"" replied the duke ; "" for you know my military avocations at this time require my presence here."" "" And here,"" said I, "" you will fall be- neath the poniard of our secret enemy."" My father was going to urge something further on the subject, when a messenger D 3 arrived arrived from court, with dispatches from the king, informing us that Sebastian had been beset by banditti, and seriously wounded ; at the same time conveying a sarcastic message from donna Isidore, thanking me for the frequent visits I had lately paid her. I had been betrothed from infancy to this lady, who was of high birth, possessed of immense wealth, a fine figure, a tolerable share of beauty, a great stock of pride, and a tyrannical temper ; such was the wife, my father and the king, who had my interest much at heart, had chosen for me. It must be confessed, I bad not been the most attentive lover in the world, and certainly had given the lady some little cause of complaint; for supposing she must inevitably be mine, I did not think it necessary to trouble my head about her ; — such are the ill elBPects arising from parents betrothing their chil- dren in infancy! But to return. The duke had no sooner read the dispatches from the king, than he changed his mind respecting respecting my quitting Spain, saying — """,matt
70,"Why the bkzes be talking of dying ! That's the way, tho' in France and in Spain, Where love is not real, but acted. You must always purtend you're insane. Or at laste that you're partly distracted. Tol lol de lol, &c/ "" It is veiy unlikely that the reader will estimate Billy's impromptu as did the com- pany ; in fact, it possessed the greatest of all claims to their admiration, for it was partly incomprehensible, and by the artful intro- duction of a word here and there, of which his hearers knew nothing; the poet was well aware that he was securing their heartiest approval. Nor was Billy insensible to such flatteries.",matt
75,"Buoyed up by these thoughts, his report on board the Adalid was free from those humiliating details, which, even if he had wished, he would have found no voice to communicate to his royal cousin. Monina's task of imparting to her friends the destitute condition in which their sovereign arrived, was even easier, “He is come among tall men,” said the pompous Heron, “who can uphold him for the better king, even to the satin of his doublet.” “And fight for him, even to the rending of our own,” cried Skelton. “And die for him, as he must too, when all's done,” said Trereife. “A soldier's death is better than a dastard's life.” “We will have out our men in goodly array,” said Heron. “Master Skelton, are the doublets cut from that piece of sad-coloured velvet, last of my wares, slashed with white, as I directed?”",matt
80,"— But if wc make peace, then farnine will arisc ; for our people are more than can be fed. Wc ask food and receive not. Stranger. —Ve ask and receive not, because ye ask amiss. As well might ye expect the cold and hungry to receive, because ye say, "" be ye warmed, and be ye filled,"" as because ye only pray. Jehovah fed our fathers in the wildemess with manna rained down from heaven : but he hath long given us fields to till, and bid us rejoice in the harvest. Samaritan.",matt
85,"We offer thee peace, to perform the rites due to the ashes of the mighty king — take it or refuse it, now, and at a word."" Onegisus caught the arm of Ellac, as he was about to reply, and whispered with him eagerly for several minutes. Ellac looked down sullenly on the ground for a moment, and then raising his eyes, replied, M Peace ! let it be peace for those two days ! I swear to keep it inviolate by the ashes of my father, and by the eternal gods. But after that, oh Arderic, will come the trial between thee and me. The hosts that have conquered under Attila shall not be divided under his son.",matt
90,"I did not desire his death. I would have saved his life had the power to do so been given to me. Oh God ! ' she cried, ' it is cruel to talk or to look so as to make me feel as if the responsibility of all this were mine ! ' She clasped one hand over another upon h ji heart, drawing erect her fine figure into a posture full of indignant reproach and passionate depre- cation. Indeed, had I never met her before and not known better, I should have taken her to be some fine tragedy actress who could not perform in the humblest article of an every-day common- place part without dressing her behaviour with the airs of the stage. 1 Pardon me,'",matt
95,"Women seldom ask the advice of their friends till they have quite made up their own minds on the subject, so it was not with any idea of being' deterred from her project^ or having"" its futility pointed out that she submitted her plan to Mr. and Mrs. Vallack, at breakfast time. Dr. Bag-ot must be seen and consulted, and time would be required ', but Flora had somethino- to look forward to. "" Even the chance of a little g""ood rather than sitting down quietly under the certainty of all evil/^ said she ; "" give me even fear and dread of misery and disappointment, so as I am not deprived of every hope of happiness and ex- pectation of success/' With this httle beam of sunshine on her spirits^ Flora put on her shawl to enjoy the brief hour of March sunshine out of doors^ comforting"" herself with the possession of Guy's letter. It was something* to feel even that in her bosom. She would have escaped from Mr. and Mrs. Vallack to read it again, but it would seem selfish to leave them; besides, on the broad gravel walk was where it was dryest and pleasantest.",matt
100,"Don't take the trouble to deny it, for I know everything. I sat behind you last night at the theatricals, and heard every word you said to each other. And now Godfrey Harland, who holds the trump card — you or I ? ' He did not attempt to answer her, but turned his face towards the open door, and stood gnawing his moustaches, and wondering how he should extricate him- self from the mdrass of perplexity in which he was sinking. * You did not give one thought to me — left to struggle with poverty as best I could. Had I remained behind, I might have become anything — a lost, abandoned woman — God knows ! But I have fol- lowed you, as you see, and I am here to claim you as my husband.' *",matt
105,"In the church of Santa Maria- sopra- Minerva, Roma."" And the painter is a man— Hans Riemann, you see. Well, all one can say is that some men have much nicer tastes than some women. . . . Hadn't we better go on to the next room, or we shall not get it all done before lunch .^' ' Oh yes ! Come !' They walked away.",matt
110,"no, no ; the noblest deer hath thera as huge as the rascal. Is the single man therefore blessed ?— No ; as a walled town is worthier than a village, so is the forehead of a married man more honourable than the bare brow of a bachelor ; and by how much defence is better than no skill, so much is a horn more precious than to want."" The P — — and his party were now about about to turn away, when Mr. S advanced, and addressed the sibyl thus: "" You secrer, bihek, and midnight hag, I conjure ^ou by that which you profess (Howe'er you come to know it), answer me .- What fame posthumous will be mine r"" The sibvT turned to her book, and said^",matt
115,"Mortiz Ally was the Nabob's brother-in- law, bound to him by every tie of gi-atitude and affection ; but amongst these people such ties count for nothing when once interest is at stake. The Nabob knew that inherited wealth and parsimonious habits had made Mortiz Ally the richest man in his dominions, and was determined that he should con- tribute to the satisfaction of the greedy Morattoes in common with the other governors of the province. None of these gentlemen were too well inclined to disburse their treasures, and needed but the example of a respectable leader to refuse obedience to the Nabob's demand. They, therefore, took occasion to hint to Mortiz x\lly that Nizam-al-Mulk, the Soubah of the Southern Provinces, would be inclined to favour rebellion against a prince who had defied his vice-royalty. ' In the East, rebellion generally means assassina- tion.",matt
120,"Ah ! my poor girl, you suffer worse than I do, for your pains are of the heart."" "" I M^ll go, sir, I will go !"" cried Helen ; '' though it is very bitter so to do, yet I will go, if it can serve Mademoiselle d'Albret, even in the very least."" "" It may serve her much, young lady,"" said Estoc. "" As this sad affair has happened, and she has fallen into the hands of the Leagu- ers, beyond all doubt they will send her to Marzay ; and then the old story will begin again, and no devilish scheme will be too bad, to drive her to marry Monsieur de Chazeul."" *' Oh, no, no, no !"" cried Helen vehemently ; "" he will betray her — he will make her misera- ble, as he has made me. What right has he to marry her ?"" she continued, with her brow contracted and a wild look coming into her eyes. """,matt
125,"His voice shook ; his hand, holding hers, was chill and cold. ""Believe me — believe me, dear Mrs. Ker- shaw, there never shall be anything in my life that shall make me unw^orthy of the love your dear one bore me ; never anything that shall make me unworthy of the sacred kiss she sfave me — the kiss that was her last o good-bye."" Mrs. Kershaw was leaning her arm upon I HAVE NO ONE BUT YOU ! "" 53 the table, and had covered her drowned eyes with her hands. "" Do not heed what things you hear,"" went on Cyril, pleading. ""Believe in me, trust me, you who have been my best friend ; be- lieve that even if I am "" Here he halted, and she raised her head and looked at him through her tears. "" If you are in trouble, in perplexity, in doubt, can you not come and tell your troubles to my husband, he who is so wise and good, and would give you such good counsel ?",matt
130,"COLLINS (WILKIE), NOVELS BY. Cr. 8vo. cl. ex., 3s. 6d. each ; post 8vo, illust. bds., 2s. each ; cl. limp, 2s. fid. each. ANTONINA. With a Frontispiece by Sir John Gilbert, R.A. BASIL. Illustrated by Sir John Gilbert, R.A., and J. Mahoney.",matt
135,"I did not think you were so ill,"" said Montgomerie, gently, forcing back the impulse that prompted more passionate pity, for he saw the effect of the excite- ment and slight fatigue she had encount- ered were almost too much for her strength. "" I am not ill, not very ill,"" she an- swered, somewhat bitterly ; Cf anyone may have a cough, that is nothing."" "" But yours is painful,"" Ruy said, meet- ing her timid glance by a grave and tender expression of countenance. "" Surely, after five years of separation, we have other things to speak of than the symptoms of an illness. I hope you for- give me for coming here unbidden. I think you know — if you have not forgot- ten — that it has been the wish of my life to see a faithful picture of Saint Cecilia, and yours is sure to be beautiful."" ""I have not forgotten one word of all the few you ever uttered to me,"" said Montgomerie, somewhat sternly ; "" the hap- piest moments of my life have been ever impossible to forget.",matt
140,"You — my little sister — why what could you do ? "" '-'- Yes, your baby, Madge dear, would like to do something. She cannot bear to see you wearing your heart out over farthings any longer. It is such small work, Madge, this grizzling and scraping and managing ; it would be so much greater to strike out a line of one's own, and thus satisfy the hunger of both mind and body at one and the same time."" Margaret sat down and looked, but did not attempt to si3eak, and as the fire flickered up and cast a gleam of light on her face, its expression of sorrowful surprise filled in the words her tongue refused to utter. Hers was a beautiful face. She had exquisitely chiselled features, soft, sweet, and Madonna-like, with sad grey eyes which told their own tale of patience and lasting endurance, but she wholly lacked the passion which was continually bursting forth in Pettita, nor could she comprehend its surgings, or follow its sudden storms and vagaries.",matt
145,"A few scattered shot from Peachy's advanced guard broke in upon these regrets; Richard in a moment recollected that this was a time for action, not for words. He issued a few commands as to the position of his troops, and riding to their front, addressed them: “My merry men, and very good friends,” he cried, “let us recollect that we are soldiers; our lives depend upon our swords; draw them for the right, and be strong in it. Our enemies are chiefly raw recruits; cold friends of a tyrant-usurper; but they are many, and death is before us; behind our vessels, the wide ocean, safety and freedom: we must retreat, not as cowardly fugitives, but as men who, while they see, fear not their danger.” The order of the march was speedily established. While the rear retrograded, Richard, with a hundred chosen men, made a stand, receiving so well the first onset of their assailants, that they were staggered and driven back. “In good hour, spare neither whip nor spur,” cried York; and turning his horse's head, he galloped towards his retreating friends. Peachy, who believed that he had them in his toils, followed slowly and in good order.",matt
150,"He had letters to the chiefs of the department at all these places, and to the Head of the whole Siberian Commission at its centre in Perm. "" An adventurous young Englishman,"" his friends thought him as they gave their introductions ; but they doubted his energy holding out beyond Novgorod, and they strongly advised him to test the fascinations of St. Petersburg instead. But Gilbert was determined, and quite dauntless against all persuasion he set forth. At Perm he procured an interpreter, one of the onlv three men who, in these remote regions, understood both ""Little Russian"" and French ; and thus accompanied, he proceeded onwards again. In a^Teljega, with a trusty moujik driver and four fast fleeting steeds, he started, and soon the lono^ monotonous travel- ling of the wind-swept Steppes became fami- liar to him. Through days that seemed endless and innumerable, he skimmed across those snow-clad plains. He drove through the drowsy air of wonderful moonlit nights, VOL. III.",matt
155,"King Jamie carried this prejudice to England, and is known to have abhorred pork almost as much as he did tobacco. Ben Johnson has recorded this peculiarity, where the gipsy in a masque, examining the king's hand, says, —you should by this lineLove a horse, and a hound, but no part of a swine. The Gipsies Metamorphosed. James's own proposed banquet for the Devil, was a loin of pork and a poll of ling, with a pipe of tobacco for digestion. The liquor was supplied in the same proportion, and under similar regulations. Excellent claret and champaigne were liberally distributed among the Chief's immediate neighbours; whisky, plain or diluted, and strong-beer, refreshed those who sat near the lower end. Nor did this inequality of distribution appear to give the least offence.",matt
