passage.number,passage,annotator,nondomestic,notes
252,"Definitively then, you will not allow me to write to the minister?"" *^ If I permitted all my prisoners to write to his Excellency, his whole time would be lost in reading petitions, and / should deserve to lose my place. I have heard enough. '' "" One word more, Captain ! If the words of a honest man possess any value in your eyes, I swear to you that the honour, life, and for- tune, of the Count von Spulgen, as well as the repose of another whom I will not now name, are at this moment in the greatest danger ! If, this day, the minister do not get my letter, to- morrow he is lost!""",alex,,
257,"This reason cannot yet be mentioned— he had hardly revealed it to himself—it was deep down in his soul—to be or not to be—as circumstances, time, and the hour should decide. After having lived so long in retirement, our young hero, when he was to go into company again, had many fears, that his manners would appear rustic and unfashioned. With all these apprehensions as to his manners, there was mixed a large proportion of pride of character, which tended rather to encrease than to diminish his apparent timidity. He dreaded that people should value him, or think that he valued himself, for his newly acquired fortune, instead of his good qualities—he feared that he should be flattered—and he feared that he should like flattery. —In the midst of all these various and contradictory apprehensions, he would perhaps have been awkward and miserable, had he been introduced into society by one who had less knowledge of the world, or less knowledge of the human, heart than Sir Ulick O'Shane possessed. Sir Ulick treated him as if he had always lived in good company. Without presupposing any ignorance or any difficulty, he at the same time always took care to warn him of any etiquette, or of any modern fashion, so that no one should perceive the warning but themselves.—",alex,,
262,"In 2 vols. 8vo. Price 1^ lOs. in Boards. ANECDOTES of the MANNERS and CUSTOMS of LON- DON from the roma\ INVASION to the Year ;700; including the Origin of British Socif.fy, Cnstoms, and Manners. A general Sketch of the State of P.e>i- gion. Snperstilion, Dresses, and Ainnsements of the Citizens of London, during that Period.",alex,,
267,"§s. — Or to accom- modate those purchasers who desire the parts separate- ly — The Animals, 4 vols. Si. 10s. — The Vegetables, 2 vols. 2l. 2s. — The Minerals and Life, lOs. 6d. *' Thus may our Life, exempt from public haunt, ** Find tons^ucs intree>, books in the running brooks, *' sermons in stones, a,nd good in every thing."" Shakespeare. The sphere of this great man's studies was no less exten- sive than all the productions of Nature '.",alex,,
272,"All work makes Peter discontent!"" Hubert is intensely amused by this gravely delivered speech. ""This is Miss Precocious,"" he says to his wife in English. "" Speak ee-ze Engliss,"" announces the "" fairy."" She has a sweet, merry face, and looks very kissable. She stretches up her small hands now and begins to play with the great bunch of seals and trinkets attached to Hubert's Avatch-chain. He regards her attentively the while, and says to his wife, "" She is a juvenile Hebe. What limbs she has, and what a bonnie face.",alex,,
277,"The children appeared almost distracted; their grief had more of that stunning character which attends unexpected calamity, than of sorrow for one who is gradually drawn from life. At length the messenger entered the room, and almost choked with tears, stated that both priests were absent that day at Conference, and would not return till late. The hitherto moderated grief of the wife arose to a pitch much wilder than the death of her husband could, under ordinary circumstances, occasion. To die without absolution--to pass away into eternity ""unanointed, unaneled""--without being purified from the inherent stains of humanity--was to her a much deeper affliction than her final separation from him. She cried in tones of the most piercing despair, and clapped her hands, as they do who weep over the dead. Had he died in the calm confidence of having received the Viaticum, or Sacrament before death, his decease would have had nothing remarkably calamitous in it, beyond usual occurrences of a similar nature. Now the grief was intensely bitter in consequence of his expected departure without the priest.",alex,,
282,"Madame Duval was in ex- tacies; and the Captain flung himfelf into so many ridiculous distortions, by way of mimicking her, that he engaged the atten- tion of all the company *, and, in the midst of the performance of the Coronation An- them, while Madame Duval was affecting to beat time, and uttering many expreftions of delight, he called suddenly for faits, which a lady, apprehending fome diftrefs, politely handed to him, and which, instantly applying applying to the nostrils of poor Madame j_)uval, fne involuntarily fhuffed up such a quantity, that the pain and surprise made her i cream aloud. When the recovered, flic reproached him, with her usual vehe- mence -, but he protested he had taken that meal ure out of pure 'friendship, as he con- cluded, from her raptures, that the was going into hysterics. This excuse by no means appeased her, and they had a violent quarrel -, but the only effect her anger had on the Captain, was to encreafe his diver- sion. Indeed, he laughs and talks so terri- bly loud in public, that he frequently makes us ashamed of belonging to him. Madame Duval, notwithstanding her wrath, made no fcrupie of returning to dine in 'Queen-Ann- street. Mrs. Mirvan had secured places for the play at Drury Lane Theatre, and, though ever uneasy in her company, she very politely invited Ma- dame Duval to be of our party -, however,, she had a bad cold, and chose to nurse it. I was sorry for her indisposition, but I knew not how to be sorry she did not ac- company us, for she is — I mutt not fay what, but very unlike other people.",alex,,
287,"Why, this thing "" — stroking her dark sables gently — ""must have cost more than the whole annual allowance I shall be able to give you, my poor child."" "" Oh, but it isn't paid for,"" answered Nina, placidly. This was hardly the sort of argument to reassure a prudent economist. *' It will have to be paid for, though,"" he submitted, with a shade of anxiety in his tone. "" Oh, yes ; some day. I don't let my trades- men bother me.",alex,,
292,"Paul and Halliday retired into a small recess in the interior of the cavern ; they were soon joined by several mariners whose heads had been left untouched by the liquor-cup. The following con- versation took place, and the ears of Maud drank in every sound with an anxiety amounting to pain. '' Weel, Paul, man,"" said a stout weather-beaten personage from the Mull of Galloway, — wee), man, and what's the grand tidings which ye have brought frae the west ? What prime news hae ye frae the great western continent, as Willie Macdowell called it — Ye wad ken Willie — a great scholar — spoke for ever, and called the sun the chief luminary of heaven, and the moon the lesser light, and the Wild Goose free trader a winged palace that walked on the great deeps. Aweel, what""*s your tidings frae the great western continent ? What says the seed of yea and nay, of grave Penn, and half-hang- ed Habbie Hempseed, to their rum free frae duty and their tea free frae tithe .'*"" "" Macgubb,"""" said Paul, '' you have resolved the great question of human freedom into one of strong drink. Yes, the descendants of the wise and valiant men, whom the folly of our former kings drove into the great American wilderness, are resolved to do something worthy of their fa- thers.",alex,,
297,"Is it the end ? Is it all really over ? There had been a faint flicker of the dymg candle — a tiny glare — and now — for all time is it to be dark- ness ? As for her ; ever since he had let her hand go, she had stood with bent head looking at it. He had taken it — he had let it go. There seemed to be a promise of Heaven — was it a false one ? She is silent.",alex,,
302,"they are re-united now. But how pitiful to think of that long life, filled with one maddening thought, one long waiting for the impossible, the whole of God's fair creation walled up and stifled in one crushed brain ! If one were to love like that — God forbid ! — it were better to taste death at once. But Gwen- doline's story had ever haunted me ; and, though I loved the terrace on a fine summer's morning or in the full glory of the afternoon, twilight always banished me from the spot. I could not have paced under those dark trees alone without fancying I heard a soft footfall behind me ; and though I have no abject belief in ghosts, still, if a white figure were suddenly to start up and wring its hands, I ' Dreaming as usual, Olga ?' ' Aunt Catherine,' in a confused voice, for there was Miss Sefton standing in my path, and I could see the amused look in her eyes, * I was thinking of the Lady Gwendoline,' I blurted out. ' What put her into my head, I wonder ?'",alex,,
307,"— Or spare my father, pangs which I know must kill him, by snatching myself from this terrible sacrifice !"" "" You speak darkly,"" said Sir George — "" or else, I am reluctant to understand the meaning of your words."" "" I came not to speak in riddles,"" continued Caroline, in the same suppressed voice, "" when I came upon the errand that has brought me here. God knows what it is I do — but I am so very wretched, and the alternative to which I am bound is so very dreadful, that I may hope to be forgiven ! In this room, not a week since, you condemned, indignantly, the ' bar- gain,' as you called it, ' which bartered away the long happiness of a young heart, to gladden the cold passions of a selfish one !' These words sunk deep into my soul. A thousand times they have fallen from my tongue, since I heard them.",alex,,
312,"“No, no, it is not man's nature. I will not allow it to be more man's nature than woman's to be inconstant and forget those they do love, or have loved. I believe the reverse. I believe in a true analogy between our bodily frames and our mental; and that as our bodies are the strongest, so are our feelings; capable of bearing most rough usage, and riding out the heaviest weather.” “Your feelings may be the strongest,” replied Anne, “but the same spirit of analogy will authorise me to assert that ours are the most tender. Man is more robust than woman, but he is not longer-lived; which exactly explains my view of the nature of their attachments. Nay, it would be too hard upon you, if it were otherwise.",alex,,
317,"Yet this man was not cruel by nature. Perhaps it grieved him to be compelled to treat his prisoners with so much harshness \ but he made it a point of conscience to adhere, in the most punctual manner, to the oath which he had been obliged to take to the Count of Easing wold. * "" You see/' said he, "" that I am indulgent, as far as ;lies in my power I received no particular command respecting the imprison- ment of the child, who was deli- vered to my custody at the same time with her mother ; and there- fore I allow him to enjoy all those advantages from which I am com- pelled to debar her and yourself ; neither was it forbidden me to furnish Mercia of Windermere with such sources of mental amuse- ment as would beguile her soli- X.-W'X^'VV-V'VV^^^'V^.^^^.V^'V^-^.'X.-V^.-^-'V'V^.X. tary hours. She has a variety o books, her spinning-wheel, and her embroidery-frame.",alex,,
322,"that was the black who killed poor Shane I I saw the dart come from the tree.' ' Pardon me, Missouri/ said Deverel, grasp- ing his hand; ^I will try never to form a wrong opinion of your actions again.' At nine o'clock in the evening the river began to rise with the tide, and there were strong hopes of getting the brig off. The mountain streams that fed the river had been swollen by the late storm, and the water rose rapidly. About ten o'clock, however, there was a fresh alarm of the approach of the blacks. The night was very dark, and the canoes were nearly alongside before they were discovered. The large guns could not be used, and the blacks were soon climbing the sides. , Lamps were burning over the deck.",alex,,
327,"How much of this outcry for gold did Mr. Craig think would be superseded by the customers of country banks being referred to the Bank of England for metal money, instead of having it of their own bankers ? ""As much,"" replied Mr. Craig, ""as the Bank may choose. It can proportion its issues to country bankers as it likes. But, in case of the adoption of this plan, it will be necessary that branch banks should be established by the Bank of England in all populous districts, so that the people may have every facility for converting their notes. Much less business would be done, much less confidence would exist, if there were delays and difficulties of any kind in converting notes which are convertible at all."" "" It is, then, only to prevent drains on the Bank of England coffers, and their consequen- ces, that you would make its notes a legal ten- der for country paper?",alex,,
332,"Our progress along this bye-road was slow. There was no white dust upon the path to guide us. We had to grope our way as well as we could between the zigzag fences. Now"" and then our horses stumbled in the deep ruts made by the wood-wagons, and it was with difficulty we could force them forward. My companion seemed to manage better than I, and whipped his horse onward as if he were more famihar w^th the path or else more reckless ! I wondered at this without making any remark. After half-an-hour's struggling, we reached the angle of the rail-fence, where the enclo- sure ended and the woods began.",alex,,
337,"My darling, you can't expect me to say that,"" interrupted Jack judiciously. "" No ; but seriously, dear, don't you think so ?"" "" She is quite a lady, no doubt, in mind"" observed the designing one, with just sufficient of detraction in his tone to insure a reply from the Defence. 11 Well, but, after all, that is the chief thing,"" said Blanche. "" And really, now poor dear Helen is dead and gone, don't you think Arthur might do worse, if he really feels a warm regard for Jenny, and taking into consideration, of course, the dreadful state in which he is in "" "" But think of old Jacob, and the inn, and the lock,"" put in Jack. 11 Well, of course, all that is bad ; but it's a question of life or death almost to Arthur ; and if he could be rescued from his solitude and melancholy by such a step, I do honestly think that a marriage with Jenny would be the best thing for him."" """,alex,,
342,"I hope it has taught me a lesson for life."" ** A fault thus nobly redeemed ** began Ippolita, her beautiful face, suf- fusing, in spite .of herself, with the sen* timekit that warmed her heart; she did not trust herself to finish the ^sentence % for now a keen pang of regret that she could be nothing hereafter to him she admired so justly, shot through her breast, «id banished from her cheek the colouring of tenderness and joy. But Valombrosa, thrilling with the tone in which she had spoken those few woMs, saw not the change. He resumed. '^ One half of the persons who retailed these tales about Prince Angelo, doubt* less did it upon as slight grounds as J beUeved them : for I never had the sense or the justice to seek out the few indiyi- duals Ddio did know the Prince's history and character, and learn from them wbe^ ^her he m&ji» indeed a proud cynic, or dhe-flisd inth a vroteid inihfis iieart fibm the.",alex,,
347,"Ah ! had you lived, I should have needed no other protector,"" continued she, bursting into an agony of tears. In the miserable predicament in which she found herself placed, she saw only the alter- native of putting herself still more in the power of Briggs, by proceeding Avith him to Calgarth Hall, or accepting the protection of Philipson. The impropriety of this latter measure appeared to her so glaring, that cost what it would to her feelings, she determined to pursue her journey with Briggs, in obe- dience to the dying commands of her mother. The tumult below now increased to louder clamours. Her name was again and again repeated in louder tones. Presently she plainly distinguished the clash of arms, and the shrill accents of old Bridget and her attendant damsel, partly in terror and partly in supplication ; but while all this reached her from below, and her anxiety to hear plainly the subject of dispute became more intense, and caused her to hold her breath, lest her respiration should prevent her facility of listening, the harsh, angry voices sank to faint whispers on her ear, and she fell back upon her pillow in a state of utter insensibility.",alex,,
352,"It was not the first time Sidney Aschen- burg had had to listen to expostulations upon this subject from his guardian ; but he sat unconcernedly enough, tossing over his straw- berries, while a slight smile played about his mouth. There was a pause of several seconds, and then Mr. Aschenbursf, 'with the touch of as- perity gone from his voice and manner, said, ""Think well before you come to a decision upon anything ; but, having come to it, stick to it — unless, of course, there is some absolutely good reason for change."" Then, as if he felt he had been speaking with undue harshness, he turned for the first time to the young man, the old kindly smile in his eyes, saying, "" And now, my boy, go to Norway and have a pleasant trip, and let us forget there was any talk of change."" For the first time the unconcern depicted on Sidney's face gave way, and he looked at the elder man resolutely, his straight eyebrows knitting themselves, and the mobile mouth stiffening in a haughty determined way. "" You have been tutoring me to be reso- lute, therefore I need not apologize if I say once and for all that I shall not go to Norway."" Mr. Aschenburg did not change his position, but kept his arms on the table and leant over them, Hs face with its benevolent expression turned upon his companion. '*",alex,,
357,"Here, I thought, are two specimens of humanity without intelligence or education, who show the natural depravity of human nature and the great power my master possesses in this world. Here is a proof that in his original state man is but little removed from the demon. Not the slightest provocation had the engineer given those two idiotic murderers. They had not even envy or jealousy to stimulate them, their brute natures not being even sufficiently organized to allow such feelings. They would have committed a terrible crime, and that from the mere pleasure to be found in its perpetration. But my satisfaction was only of momentary duration, and I found the conclusion I had arrived at was as imper- fect and disappointing as it well could be.",alex,,
362,"Never touch a pottle pot after thou hast drunk down to the fifth hoop ; for if thou dost, nis at the peril of thy five senses. Standwich — Cuthbert — State ministers — cut-throats — great amongst the little, and little amongst the great — ^ye are all as drunk as land lubbers need be. Bear a hand and help me to lie down, for my head and my legs are somewhat totty. Give us t'other cup for a night-cap. Levi count your beads, and Standwich don't forswear bacon, and you'll both be in a right way for saints : and so I say, a good morrow to you all."" The drunken pirate was led off to a couch composed of moss and dried fern, in another re- cess of the cavern. Soon after, Levi, who also was to pass this night in the rock, retired to his pallet, and composed himself to rest ; whilst Standwich and Cuthbert Mayne, and one or two others in their especial confidence, held a coun- cil as to the management of their desperate affairs, which, in due place and time, will be made known to the reader, since, whatever their determinations might be, it was not yet that they could carry them into action.",alex,,
367,"I want to go to "" (naming a town on the road to Warsaw). "" To-morrow morning,"" said the driver. "" You won't be able to get on to-morrow, I expect,"" said the man. "" Bands of insurgents have appeared in the neighbourhood to-day, and communication wdll most likely be stopped to- morrow. Better go to-night."" "" Is there no means of getting on to War- saw ? "" inquired Jagellon, now breaking into the conversation. """,alex,,
372,"Yet again and again she turned her head to look upon the fleeting sand, and as it sunk lower and lower in the glass, her heart died within her, and her cheek became more pale ; but she could not say, "" the time is almost spent."" Sir Walter's eye followed hers in the same direction ; he saw the few remaining atoms dropping one by one, as it were, to tell out the flitting moments of life ; and clasping Anna in his arms, he pressed her with convulsive energy to his bosom, as if he would yield up his soul in death, where it delighted to hover in life. "" Farewell, Anna,"" he said ; "" oh ! may He who is the Father of the fatherless^ comfort and bless you."" Anna could only answer with her tears. "" My time grows short,"" continued Sir Walter ; ^^ I hear a stir without — they are coming for me.",alex,,
377,"' Sincerely yours, ' Pablo Somerville.' This Invitation gave him a sense of relief, inexplicable, but strong. With Father Somer- vllle he felt entirely at his ease ; felt that he was understood, was not taken to be a hero, or anything else that he really was not. Here, at the Abbey, he had the very oppo- site sensation. He knew that he was looked upon In the light of an unusual and remarkable phenomenon. He knew, for he had a keen.",alex,,
382,"Well, where does she live ? "" The clerk eyed him suspiciously : the face did not attract confidence. Was this likely to result in an interesting case in the police-news ? "" Looks as if he might be an amy-toor detective,"" thought the youth. An "" amy-toor detective "" conveyed no very definite meaning to his mind, but had a vague general connexion with people who were "" wanted."" The suspected one observed the questioning gaze. "" You need not be excited, my friend,"" he said reassuringly. ''",alex,,
387,"There was something so honest and good-humoured in the appearance of this man, that I fancied I might safely request his advice and assistance, in pro- curing the means of removing to some distant town. I invented a story of being- sent for to Bristol, to attend a dying re- lation, and found him intelligent and kind- hearted. He told me, that although Lon- don was certainly quite out of my way to Bristol, yet, he thought I was more likely to obtain a conveyance from that place than any other ; and said^ he had no doubt, he should meet with some friend at S 3 who would convey me to the metropolis. At first I felt averse to this scheme, till recollecting that I should find it much easier to conceal myself in London than in S , or any of the adjacent towns, I thanked him, and accepted his offer of endeavouring to procure me a safe and speedy means of continuing my jour- ney. ''On arriving at S , the worthy farmer advised me to amuse myself at the fair, as he certainly could not enable me to quit the place till the next day. This proposal, however, I declined, alledging and with truth, that my mind was too anxious and uneasy to admit of my tasting any pleasure. He therefore conducted me to an inn; and I was shewn by the landlady into a room, where I passed a melancholy day.",alex,,
392,"""I am aware,"" he said in his plausible man- ner to the doctor, ""that it is useless my endea- vouring to keep up the deception any longer. Pray excuse me ; I am sure you would do so if you knew all. Nothing, of course, can be more painful to a man who has enjoyed the reputation of foresight and knowledge in his profession that I have than to be obliged to admit a mental infirmity, — for such I would hold it to be in another person, however learned he might be in his particular walk. At the same time let me assure you that you are in error in imagining anything like remorse to be connected with it, as I presume you intended when you spoke of Banquo's ghost ; I am happy to say that I invari- ably conducted my business in a strictly hon- ourable and just manner, and never in a single instance in the whole course of my career did I overstep the limits of the professional licence the law allowed me."" A slight and almost imperceptible grimace passed over the doctor's countenance, as if he imagined it perfectly easy to be dishonest, and yet to be within the limits of the law. He, however, made no remark on the subject, simply contenting himself with apologizing for any acci- dental incivility he might have been guilty of, and VOL. II.",alex,,
