passage.number,passage,annotator
160,"If I do not succeed in putting you altogether out of my mind, I would sooner be able to remember you — as you were."" A spasm of pain passes across her face, leaving it deadly white. For a moment she seems about to turn, and escape from his presence. Then with an effort she faces him again, and says simply : "" You mistake me. I am only here to give you something which is yours by right, which I think you ought to have. I found this packet yesterday in an old desk of my father's.",matt
165,"— Authority of the Fathers for Practices not to be proved by Scripture. — Jones of Nayland and the Unitarians. — Council of Trent opposed to the Fathers. — True position of a Protestant.— The Faith once delivered, &c. — How to battle with Popery. —",matt
170,"Directly the fiddles were laid down, Mr. Penny's spectacles put in their sheath, and the text had been given out, an indignant whispering began. ‘Did ye hear that, souls?’ Mr. Penny said in a groaning breath. ‘Brazen-faced hussies!’ said Bowman. ‘Trew; why, they were every note as loud as we, fiddles and all, if not louder.’ ‘Fiddles and all,’ echoed Bowman bitterly. ‘Shall anything bolder be found than united woman?’",matt
175,' he cried. ' Oh ! it is — it is Francesca ! You ! — you ! — you ! have come to see me again after all these years ? I thought you dead long ago —dead.,matt
180,"As we stood, once more utterly depressed, I thought I caught a sound, to which I called the attention of the others. It was very faint, and very far off, but it was a sound, a faint, murmuring sound, for the others heard it too, and no words can describe the blessedness of it after all those hours of utter, awful stillness. “By heaven! it's running water,” said Good. “Come on.” Off we started again in the direction from which the faint murmur seemed to come, groping our way as before along the rocky walls. As we went it got more and more audible, till at last it seemed quite loud in the quiet.",matt
185,"Whh a Frontispiece. Crown 8vo , cloth extra, 3s. 6J. ; post 8vo, illustrated boards, 8s. CROKER (BTM.), NOVELS BY. Crown 8vo, cloth extra, 3». 6d. each ; post 8vo, illustrated boards, ^i"".",matt
190,"But he did not spend this money ; from the moment he had determined to enfranchise himself socially, he had set it aside religiously, with a growing interest, worthy of a miser or a millionaire. Before Geraldine had left town, she had offered him more than she had ever done before, and he had refused it, exhibiting his privily-hoarded store with a kind of grim glee, for he considered such a store all-sufficient for every emergency even of an art career. So positively refusing, Geraldine could not make him take any more money, for his will was as much stronger than hers as his intellect was weaker, and she left him, inly wondering herself how he had contrived to save it, when she had spent twice as much in the same time — not on her dress, for that was ever simple, but in baying the costliest and most charming presents for Diamid, such as could be of no'possible use to such a man, or, indeed, a man at all, and in throwing away coin on every crowd of beggars, or single beggar, that beset her car- riage, and whom her servants dared not drive away for fear of receiving their discharge — for by all servants who had ever lived with him, Albany was literally idolised, a rather singular tribute to the goodness of heart of one whose development, whose breeding, and intellectual perfectness, were utterly above their compre- hension. Before she left Geraldi, however, Geraldine charged him to let her know when he wanted money, adding ^^ I shall not tell Diamid, because you are foolish, and fancy he does not like you, but you don't mind asking me for any- thing ; I would take anything from you^ This was balm to Geraldi, he felt as though he and she had a secret between them which her husband could not share. In his note to Eodomant, Geraldi had touched his taste by employing the fewest words, "" I am miserable, unfortunate, and proud.",matt
195,"Which, laid on an eye, that grieves. Shows each sprite of grove, or rill. "" Three hazel- wands peel smooth and white. Just a twelvemonth old — no more ; Thrice on each wand the full name wnrite Of the Fay you would implore. '' Then in earth these wands consign ; In earth, that elfin footsteps tread.",matt
200,"1 Belongs to gentlefolks if ever a bairn did f — ' More like a little lord, wi' his fine clothes, and those fearless eyes of his, like a lion's !' 'How came he here, though, on the sands, by himself?' was a very general question; and the query was one which it was easier to ask than to answer. Clearly, no relative, no friend, no servant was in sight, either on shore or cliff-crest, whose presence could account for that of the solitary child. It really was as though the tiny creature — he could not have been more than four years old — had dropped from the sk} T upon that bleak and desolate beach. How came he here ? To whom did he belong ?",matt
205,"But that is not all : she has left the whole of her fortune to le pere Maubois ! This is, indeed, a heavy blow ; and pauvre Florestan and I are nearly overwhelmed by it. I have long expected that she would have bequeathed a considerable portion of her wealth to her Jesuitical confessor; but, that she would leave him all, never entered into my mind. The only legacy I have received is a letter filled with reproaches for my extravagance and errors, and an exhortation to turn from my evil courses ere it be too late. My liaison with the due she stigmatises as a crime of the deepest die, meriting opprobrium here^ and perdition hereafter. In short, never was there such an epistle. It is, however, well calculated to preclude any very deep regret for the writer ; though it prevents not my chagrin for the loss of my fortune.",matt
210,"Don't you see? "" This was the answer — "" Furvoket much at my rude tongue, A dish hrath at me he vlung. Which so incensed me to wrath, That I up an hnack un instantly to arth. Diddle-diddle ! '' "" As for your Princess Sheila, I firmly believe you have some romantic notion of marrying her, and taking her up to London with you.",matt
215,"She opened several. In one room she was frightened by a bat, which had very nearly put her candle out. She went on a little, paused, and began to lose heart in the dismal solitude, when on a sudden, a few doors farther on, she thought she heard Madame's voice. She said that she knocked at the door, but receiving no answer, and hearing Madame still talking within, she opened it. There was a candle on the chimneypiece, and another in a stable lantern near the window. Madame was conversing volubly on the hearth, with her face toward the window, the entire frame of which had been taken from its place: Dickon Hawkes, the Zamiel of the wooden leg, was supporting it with one hand, as it leaned imperfectly against the angle of the recess. There was a third figure standing, buttoned up in a surtout, with a bundle of tools under his arm, like a glazier, and, with a silent thrill of fear, she distinctly recognised the features as those of Dudley Ruthyn.",matt
220,"How could I suspect a man so reli- gious ?"" "" Reeleegious — reeleegious, indeed, why do ye not ken that it is the reeleegious folk that are the greatest scoondrels."" "" I know that is the prevalent opinion, but the truth of it I have never examined, and, except in this one instance, have never expe- rienced."" "" Mr. Huntingdon's proceedings of late were open to every body in the hoose."" "" I depended on Huntingdon from Mr. Roberts's character of him — the old man had employed him many years, and had assured me that he examined his accounts every day, and never found him in the least fraudulent."" M I should just like to ken, how the de'el any mon could have an opportoonety to be fraudulent whose accounts were examined every day — I believe you never examined his accounts at aw."" This simple and obvious truth, had never occurred to Mr. Howel before, his blindness to it had been his ruin, and it now came so for- cibly upon his mind, that he struck his fore- head in agony. "" Haud yor hond, baud yor hond, Mr. Hooeel, you will find mickle good in going on in sic uncoo ways ; I did not mean to hurt your feelings, Sir, aw may be weel yet ; come, Sir, you don't do honor to my Fairintosh, and there is na other body this side the Tweed but yoursel, should have a sip of it— take another glass, Sir, take another glass."" """,matt
225,"He was avowedly an Irishman and a Romanist. I was prejudiced against the one — I was bigotted against the other ; and my aver- sion towards General Sarsfield became uncon- trolable-and unbounded. It was possible that time or a more intimate acquaintance with his character might have in- duced me to alter the feelings which unfavour- able first impressions had given birth to; but an incident occurred which fatally confirmed our mutual enmity. I was proud and tenacious of my manorial VOL. I. G rights. A pheasant having wandered from my preserve, was inadvertently shot by the gene- ral's favourite servant in his shrubbery.",matt
230,"""I'm exerceesed i' my min','' he said, as soon as they were clear of the stragglers, "" aboot the turn things hae taen, doon-by at the Barn."" "" They tell me there 's some gey queer customers taen to haudin' furth,"" returned Malcolm. "" It 's a fac',"" answered Peter. The fowk '11 hardly hear a word noo frae ony o' the aulder an' soberer Christi-ans. They haena the gift o' the Speerit, they say. But in place o' steerin' them up to tak hold upo' their Maker, thir new lichts set them up to luik doon upo' ither fowk, propheseein' an' de- nuncin', as gien the Lord had committit jeedgment into their han's."" ""What is 't they tak haud o' to misca' them for?"" asked Malcolm.",matt
235,"I could deem that they had power to sanctify my words ; and I almost — yes, I do — dare to say, God bless you! and farewell! « R. Arden."" Francesca's tears fell fast upon the scroll, and some time elapsed before either could speak. Guido was the first to break the silence. "" What a vain dream it is,"" exclaimed he, "" which we call life ! First comes the fever, and then the exhaustion.",matt
240,"His sloAV, quiet, yet firm footfall was known amongst those animals as well as their mas- ter's or Edgar Adelon's, and at two or three hinidred yards they had recognised it. After a moment's consideration, Filmer rang the bell gently, and the next instant Olive himself appeared with a light in his hand. He was fully dressed, and his face was grave and composed. "" Ah, father,"" he said, as soon as he perceived w^ho his visitor was, "" this is kind of you. Come in. Helen has not gone to bed yet."" "" I am glad to hear it, my son,"" replied Filmer, "" for I want to speak a few words with you both.""",matt
245,"The first volley of the Highlanders gave a tem- porary check to the enemy, and enabled the 34th and "" old Half-hundred "" to reform in order. The French hne was now, as I have said, within thirty paces, and every lineament and feature of their dark and sallow faces could be distinctly seen at so short a distance. They were now in the midst of all the uproar, the smoke, the blood, the danger, the min- gling of hideous groans and cries, — in short, the hell upon earth of a hot engagement, in which both parties became so heated by the slaughter around them, that all the softer passions were forgotten, and they longed, with a tiger-like feeling, to bury their blades in each other's hearts. Ronald felt his pulses thickening, the blood tingling in his ears, for the sound of the musquetry had deafened them to every thing else, and his heart rebounded within his bosom until he could almost hear it beat ; but it was with feelings the reverse of fear, — a wish to leap headlong among the enemy, to cut them down with his sword as he would whin- bushes, and to revenge the slaughter the terrible fire of so dense a column was making among his gallant and devoted regiment. So thick was the smoke become, that he could scarcely see the third file from him, and only at times it cleared up a little. What was then revealed, served only to infuriate him the more. The Highlanders were lying in heaps across and across each other, — piled up just as they fell ; while their comrades fought above them, firing and reloading with all the rapidity in their power, until struck by a shot, and down they fell to perish unnoticed and unknown.",matt
250,"John of Gaunt, Duke of Lancaster, who governs in his youthful nephew's name, and whom we have most reason to dread, is at Eoxburgh, seeking to make a truce with the Scots. He 3—2 cannot return. Then the Earl of Cambridge is at Plymouth, preparing to set sail to Lisbon, with five hundred men-at-arms, and five hundred archers, to aid the King of Portugal against the King of Castile. The Earl of Buckingham is in Wales. Not one of the three is likely to interfere with us. "" There is no one to resist us, unless it be the King's half-brother, the Earl of Kent,"" observed Wat Tyler ; "" and he will not be able to raise an army, for the nobles hate him, and will not serve under him."" '•'Our march to London will be almost unopposed,"" said the Outlaw ; "" and when we arrive there, the citizens will open their gates, and give us a hearty welcome."" """,matt
