passage.number,passage,annotator,nondomestic,notes
905,"He also observed that had the Mohawks been less eager to seize upon these trophies of victory, they would not have destroyed all their enemies upon the spot, and might now have been in possession of many prisoners. Brandt acquiesced in the propriety of these remarks, and the captives of Butler were permitted to remain solely at his own disposal. During the carousal, or, as the Indians termed it, the Feast of Victory, on this occasion, every species of riot and debauchery was indulged in to excess. To describe a scene of such frantic folly and disgusting dissipation, would be to give a representation of human depravity and degradation, neither agreeable to write nor desirable to read. While in a state of intoxication, an altercation, as was to have been expected, took place between some of the Indians and the tories, which the interference of their chiefs alone prevented from becoming serious and bloody. In consequence of this, it was agreed by Butler and Brandt, that, while the Indians remained in the Valley, they should encamp at a distance from the tories, but not so far off as to prevent the maintenance of friendly intercourse, or a speedy junction in case of either being attacked by an enemy. On visiting Agnes the next day, Butler approached her with the self-satisfied air of a wooer who thinks he can plead the merit of having performed an action of a nature very pleasing to his mistress.",matt,,
910,"Flora's grief was, however, too deeply rooted for being removed by all the kind-hearted attentions which Mary could bestow ; and her internal suffering was soon diverted, — it could not be aug- mented, — by annoyances from without. Finding that Mac Skinner, sen. had been so successful in recovering the amount of the former wadset from Glenmore, several of the most vindic- tive of his creditors thought the letting loose of that personage upon his daughter, in the spring-tide of her sorrow, might be the means of squeezing all that was squeezable out of the estate. It may easily be con- ceived, that this scheme was very eagerly relished by the wily doer j and, in order to render the measures he might pursue more efficient, he pre- vailed upon all the creditors of the chief, of whom he could obtain know- ledge, to assign their bonds, bills, and obligations against the chief; in order that he, the holder, might sue for the joint behoof. The precarious condition of the Glenmore estate, and the inroads of wadsets and annual rents, induced the creditors to execute a most absolute assignation in favour of old Mac Skinner ; and no sooner was he armed with this deed, than he com- menced operations. The ultimate object of Mac Skinner, in taking this trouble, for the behoof of Glenmore's creditors, (for that was his ostensible object,) was one of very deep and crafty purpose : It was this : to possess himself, or rather his hope- ful heir, the partner of Mac Fleecer, of the estate and honours of Glenmore ; to procure for the said heir the hand of Flora, which was, indeed, a sine qua non in the business ; and then turning round upon the creditors, to whom he had taken care to give no back bond, to set them and their claims at defiance ; and thus raise his family to the first rank in the Highlands, without any other price than a reasonable portion of legal villainy.",matt,,
915,"I should like to be about in fields, and quiet places. So I've been thinking Henry might be sent away, and I might take the management of the farm. I should like so much to see the fields again. Are they green yet, father ? And the copse where the primroses grow, how bright they used to look, like stars peeping out. And the violets that I used to gather for my mother. I wonder whether the bank is covered with them now?""",matt,,
920,"It would be wrong to say that the question did not startle him ; but, after the first strange shock of such an address, an impulse of response and sympathy filled his mind. It might have been difficult to get into ac- quaintance by means of the chit-chat of society, which requires a certain initiation ; but such a grand subject was common ground. He answered as very few of the people interrogated by the sick man did answer. He did not show either alarm or horror — he started slightly, it is true, but he answered without much hesitation : "" Yes, I have thought often of death,"" said Colin. Though he was only a second-class passenger, this was a question which put all on an equality ; and now it was not difficult to under- stand why the captain eschewed his troublesome questioner, and how the people looked embarrassed to whom he spoke. ""Ah, I am glad to hear such an answer,"" said the stranger; "" so few people can say so.",matt,,
925,"The savages accepted them. But as soon as they came down, r'r'r, the same as before — the men were killed — ^just knocked on the head, so, before the w^omen's eyes ; and the women were stripped of their very clothes, and handed over, in I dare not tell you what shameful condition, to the tender mercies of those savaere brutes there. That's what ^ve o may expect, if Hippolyte's fool enough to listen to terms. But I hope he won't. For my part, I'd sooner die first, with my tongue in my cheek, flinging a curse with my last good breath against those dogs of savages.' With such cheering conversation the night wore through and the morning dawned upon their weary eyelids. More and more Kabyles seemed to burst upon them for ever.",matt,,
930,"now then you enjoy the bloody fruits of those un- grounded suspicions, which you so lightly infused into the minds of the rash and wanton multitude ! Oh ! my wife, I fear greatly, that at the day of judgment when this mur- der is cited, your hands will not appear quite bloodless ! God forgive you !"" — The Countess shuddered, but only an- swered by a flood of tears. — "" Spare your Lady;' my noble friend,"" said Ottokar, taking the Count's hand ; "" even if your reproaches are deserved, they now come too late, and the present difficul- ties demand our attention too much to ad- mit of reflections on the past.",matt,,
935,"An unri- valled exploit turned out to be a happy conjecture — a marvellous deed was the lion's skin that covered the ears of a new- reading. I was confounded to hear the same epithets applied to their obscure de- migods, that I associated with the names of Csesar and Socrates, and Pericles and Cicero. It was perplexing to find that Pharsalia or a Philippic — the groves of Academus or the fanes of the Acropolis, could receive no higher admiration than was lavished upon the unknown exploits of a hunter after syllables. After my battle^ I was never annoyed by my former friends. As time advanced, I slightly relaxed in my behaviour, and, when it was necessary, we interchanged words, but I never associated with any one. I was however no longer molested.",matt,,
940,"And can you wonder at it ? Take a mother s advice,"" merrily ; "" send her into society as fast as you can, — marry her, and have done with it. Ha, ha, ha ! "" "" If I could send her, indeed,"" said the poor laird, ruefully. His nightmare was not the sending of her, but the taking her himself. "" And why not ?",matt,,
945,"Did you see Evaleen,"" said M^Dermot, "" with her glossy black hair, and that sweet smile upon her mouth ? — it was like the warm sun beam, M'Egan ; — but it does not warm me now as it used to do, I think ; my heart is cold, Prior, very cold, — what is the matter with me ?"" *' You are not well, my dear M'Dermot, but you will be well presently."" "" She smiled so sweetly upon me and called me her own M'Dcriiiot: and yet my heart was colli to her, to my own k)ve. Wliat could be the matter with me 1 wonder ? Don't cry Maud,"" said he to his sister, who sat next to him on the grass weeping ; — "" she will come again ; she told me so."" *'",matt,,
950,"And this campaign,"" added Mr. Eaymont, ignoring his partner's innuendo, "" will be a difficult one ; our credentials are not full."" Mr. Eout had been turning^ over a Bradshaw's guide. "" I see,"" he said, "" that Casterham is quite close to Oxmiaster. Do you not think,"" addressing himself to Mr. Eaymont, '' that it would be as well if I made some inquiry about this Mrs. Tiler, whose bill Miss Eber instructs us to redeem? I happen to know something about her, and quite lately she was very ill. It is just possible she may be dead.""",matt,,
955,"The thought of an Englishman to whom he could tell his story — or if not his story, yet* a story, something wdiich would ueem as an account of himself— was like a rope thrown out to him amid a waste of waters. Aod, as an Englishman, he would have a right to be listened to. English officials are not like American, the natural vassals of their countrymen ; but still, when a man is at his wit's end, there is something in the idea that a person of authority, in whom he has a vested interest, is within reach, v, hich is consolatory. To be introduced to this functionary, however, by Paolo, whose position did not seem to be very important, did not please Harry's pride. He sent the little fellow away with a vague promise of thinking of it, which disap- pointed the friendly little man. Paolo could not restrain his anxious desire to be of use. He went off to the Farmacia to buy soap and tooth- powder for his amico, and even proposed to fetch him the little bicchierino of acquavite, with which some people begin their day, a pro- posal which filled Harry with horror.",matt,,
960,"Many of the towns along the west coast had been attacked, the soldiers of the Republic being either driven out or massacred, and the people restored to liberty and their ancient laws. Unassisted, the Genoese found it impos- sible to resist the determined attacks of the islanders; the war was, therefore, carried on, on both sides, with unrelenting animosity and cruelty. A large number of the Genoese nobility and gentry inhabited the town of Bastia, who were terribly alarmed at the state of things throughout the island. One of these noblemen, Phillippo Carignano, was at this period gover- nor of Corsica. He was of a high, but impoverished family, and had accepted the dan gerous post at a time when there appeared every probability that the power of Genoa, over this ill-treated island, was drawing to its close. The Marchese de Carignano was a widower and advanced in life; his family consisted of a son and daughter. It was to the interest of the nobles to promote dissensions, which they turned to good account, by either confiscating the estates of the islanders, or condemning them to pay enormous fines, which went chiefly into the governor's or commissary - general's private coffers.",matt,,
965,"In court, however, whither Mr. Osborne accompanied him, he appeared humble and resigned, attempting no defence, and receiving his sentence with the meekest submission. After that time, his mind became consider- ably more composed : so that on Mr. Osborne's first visit to him after his return to his cell as a condemned man, he addressed him with affection, and said, ' Oh, my friend ! my best friend ! what would my case have now been, had not the Lord in mercy commissioned you to visit me here ?' '* ' You take my visits then as an earnest of divine mercy?' said Mr. Osborne. *' ' I do,' said Altamont ; ' I have long done so.",matt,,
970,"You're not likely to have had many letters directed to ' Edwin Marie Forester, Esquii'e (of Leigh), Poste restante, London.' "" "" Edwin Wilson, Mrs. Habbishon's, Lavender Eoad, Dalston,"" said Forester. Mr. Abrahams thought it desirable to check VOL. II. N this address by a reference to tlie latest Directory. "" It's quite a new neighbourhood,"" said Forester. "" iVnd it's quite a new Directory,"" answered the Jew. "" All right ; Mrs. Habbishon has been there at least a year.",matt,,
975,"AN HEIRESS. THEL PERCIVAL CARTON, cousin to Imogen Rhys, heiress to very great wealth, and pos- sessor of more splendid jewels than any other spinster in the kingdom, must have a chapter of introduction all to herself, since she is obviously a personage of too much consequence to be brought into a story in the casual sort of manner that does very well for girls with nothing worth mentioning a year. The precise amount of her heiress-ship was not kndwn definitely, but it was popularly estimated as being somewhere between eighty thousand and a hundred and twenty thousand a-year ; for when people talk of sums of that magnitude they are apt to become vague, and to regard twenty thousand pounds, more or less, as the merest trifle. She was an only child, and had inherited from her parents, who were both dead, a very large fortune. And besides this she was the chosen in- heritor of Mr Carton, her father's brother, who was a childless old widower of im- mense property, and with whom she lived at Carton House. A Mrs Grey, who was a poor relation of the family, also resided there, and officiated as her chaperon ; but as Mrs Grey was a nonentity, and as Mr Carton hardly ever interfered with his niece, Ethel w^as virtually mistress of the place, and did pretty much what she liked with herself and every one and thing con- nected therewith. The affairs of an heiress are of course far more worthy of attention than those of an ordinary young woman who has nothing to recommend her except her own merits, and therefore the world at large had always taken a lively interest in Ethel and what- ever concerned her.",matt,,
980,"— no, four,' says he. I'd ever been chary of trusting my own: I'd ever kept my lips locked on my affairs. And I knew what he was at. It went like a sword to my heart, already sore with the world's combat, and heaping up riches. The lad was dividing my property while life was still hale in me. vol. 11. c",matt,,
985,"His face was im- pressed upon your mind by the awful circum- stance that followed your meeting with him. You have changed very much since you were fifteen years of age, Mrs. Monckton. You were a feminine hobbledehoy then. Now you are — never mind what. A superb Nemesis in crino- line, bent on deeds of darkness and horror. No, I do not see any reason to fear this man's recog- nition of you."" The expression of Launcelot DarrelFs face",matt,,
990,"And you are to stay here till Beppo gives himself up ! You may stay till you all lie in Santa Lucia churchyard, then ! But it is impossible ; it's unheard of ! "" "" You may guess, excellent signora, that it is not a pleasant duty for a soldier to perform, to force himself as an unwelcome guest, and make his presence a means of punishment. But orders must be obeyed ! Duty admits of no refusal.",matt,,
995,"and calls his servant ^ friend Ferrol,' allowing him to be informed of his master's safety and well-being, but prohibiting this much news of him being made a matter of town talk. Lastly, we must recollect that with the exception of his own father, the young man was so well beloved, that he had not an enemy in the world ; and the ab- sence of all motive for fraud or imposition is in my mind the best guarantee for the genuineness of this letter. And although the mystery of Captain Broderick's disappearance remains as dark, or indeed, darker than ever, I think we may fairly conclude, without any fear of future disappointment, that he really is safe and welL"" ""And your opinion, Dr. Fairbrace?"" asked Hartsfoot. "" You have just heard it verbatim ; only so much better expressed in Mr. Locke's words."" '^ There! My good fellow,"" said Hartsfoot, turning: to Ferrol, *' we all three believe this letter to be true and genuine, and that you will, as it states, in some few months see your master again, safe and well."" """,matt,,
1000,"CHAPTEE lY. A WEARY WATCH. Throwing himself out of his saddle, Willem seized the fallen creature, and hin- dered it from rising by keeping its head close pressed against the ground. This was easily done; for the long, slender neck of the animal, without much muscular strength, gave him a good chance of hold- ing it down. The weight of the huge hunter's body was sufficient for that, with- out any exertion of his strength. D 2 Meanwhile the two old ones continued their flight, while Willem's horse, relieved of his load, proceeded to refresh himself by browsing upon the dry herbage that grew near. Willem had obtained what he wanted — a young girafle. It was actually in his possession !",matt,,
1005,"Be equally confident that I should re- ject it. No, no, Rachael ; I could never stomach the bread of dependence. But, come, come, no more of this; times, as you say, may mend, and we must hope for the best."" "" I have done>"" she said; '^ but, believe me, Philip will remove your scruples, and we shall all be as happy, together, as the day is long."" Mistaken innocent ! she little knew how unworthy Travers was of her tenderness — that, regardless of all mutual obligations betweeu them, he had degenerated into a libertine, and a gamester. Such is the mis- chief which accrues from the force of exam- ple, in the gay world of fashion ! Poor Rachael beheved him constant— be- lieved him the same unsophisticated being as when, in the bloom of youth and inno- cence, he first declared he loved.",matt,,
1010,"Though the frailties, foibles, and follies of others could not escape her immediate detection, yet even on their vices did she never trust herself to comment with unkindness. The affectation of candour is not uncommon; but she had no affectation. Faultless herself, as nearly as human nature can be, she always sought, in the faults of others, something to excuse, to forgive or forget. Where extenuation was impossible, she had a sure refuge in silence. She never uttered either a hasty, a silly, or a severe expression. In short, her temper was as polished as her wit. Nor were her manners inferior to her temper.",matt,,
1015,"I turn down here for the Quatre Saisons. An revoir, mon chor ! One moment ! I remember now. Enslee addi-esses her as Fanchon, — what you call Fanni I "" Yandeleur turned to go to his lodgings, the most beautifully furnished and the best situated in the whole towm. Before he reached the door it all flashed upon him at once. "" Enslee ! Fanni ! "" said he. """,matt,,
1020,"of the Anglo-Saxon Church, p. 69- The Irish saint, Columba, the famous Apostla of the Western Isles, was so continent in his youth, that he unmercifully whipt with nettles a virgin who had discovered a partiality towards him. Jonas in vita. sure to be all their lifetime raking in the foundations of old abbeys and cathedrals."" Nay, he was of opinion, that love had been one of the most powerful instruments employ- ed by providence to further the work of the early missionaries ; a doctrine, however, which I fear will go ill down with those who reject from their creed the operation of secondary causes, and clamour against Gibbon for pre- suming to think that such were employed by the Almighty in spreading the gospel ; though we see every day^ that it is strictly conform- able to the whole economy of the universe. * It was well that I had lost no time in re- cording the singular details given me by the recluse ; for he soon afterwards was seized with palsy, which rendered his speech nearly unin- * No man, I think, would defend Gibbon's insidious infidelity ; it was base and vile. But he was surely right in li e opinion, that God acted by secondary cauaes inpiO"" mulgating Christianity.",matt,,
1025,"Transmigration. I You Play me False. | A Village Coiiiedyt Post Svo, illustrated boards, 2s. each. Sweet Anne Pa g e. | A F i ght w i th Fortune. > Sweet and Twe nt y, j Frances. Collins (Wiikie), Novels by. Crown Svo, cloth extra, y. 6d. each ; post Svo, illustrated boards, 2J.",matt,,
1030,"Then this is ^' yes,"" my queen,' he said, pressing her to his breast. Rosamond hung her head, and wPiisper- ed a scarcely audible ' Yes.' They walked back together, through the wood enveloped by the sunset in a cloud of crimson and brown, like two walking in the witchery of a dream, arm in arm, hand in hand. 'Don't make me too happy, Marmaduke I Don't make me too happy,' that was what she said to him, laying her head on his shoulder in a caress soft and playful as a child's. ' I can never, never, never be ta you what you are to me. You have had other people to love you. No one else has ever loved me : except my brother, and him I cannot understand.",matt,,
1035,"holy mother! "" why thou hast had a vision, daughter,"" said the friar smiling ; whose round, plump stature must have suffered a strange meta- morphose, to have answered Imogen's de- scription. "" Was it not you, father, who caughfc "" me as I sunk to the earth ?"" "" Marry no ; I found thee seated here "" pale and lifeless, as I was returning to "" my convenr, after shriving the sister "" Agnes, who is fast following the ca- "" noness."" "" And saw you no one :"" demanded Imogen. "" None but thee,"" said the father; ""and "" truly thou didst startle me, and not a « little, daughter."" Imogen then related the circumstance of her having loitered at the grave of her departed friend, and of the figure that met her eye and addressed her. The father was too superstitious not to express some emotion at the detail : until the probability suggested itself, that either the solemnity and gloom of the place, in conjunction with Imogen's fears, had con- jured up the phantom ; or that some per- son, among the few of the neighbouring peasantry who were present at the funeral obsequies, had loitered behind ; quieted the friar's suspicions of a supernatural in- truder: and holding up his lanthorn, and perceiving the door still open by which the peasantry usually entered, he exclaimed : "" 'Tis as I suspected ; some pious hind "" was keeping his vigil at the shrine of his "" patron saint, and your spectral appear- "" ance scared him from his devotion.""",matt,,
1040,"His mind was made np, and he called after his third interview with her at the Rectory, to offer her the honour of his alliance. But he called at inopportune times, and was not admitted ; he left his card, and his sister called and left hers ; but Miss Myles gave but a cold glance at either and forgot them, so there was no help for it ; he must make his proposals in a letter, a proceeding to which he was most averse, considering that his personality and its strong claims upon an universal admiration would thus be lost. However, he had no doubt of success ; any woman would pause twice, he considered, before committing the egregious mistake of giving a refusal to the offer of his hand — any woman of sense, that is, who was gifted with sufficient discernment to be able to appreciate both himself and his position ; and Miss Myles was a person capable of such discrimination. So he wrote. This letter was one of the many stereotyped productions of that class wherein the self love of the writer is so evidently the principal factor in the production that no finely-worded meta- phors can obscure it. Hastily running her eye over the neat phrases which showed how utterly destitute the writer was of any real feeling, which want had copipelled him to make use of the disguise of many high-flown words, Mary laid it on one side with indiffer- ence ; whilst she perused with real sympathy the many applications from professors and lecturers; often re-reading those latter with grave thoughtfulness and many pauses.",matt,,
1045,"Oh, mothers have a sort of divine right in their children, and their love may go to sleep. But Sylvia's is dashed with anxiety, and therefore, if it is not so deep, it is more intense. Poor darling, she looks thoroughly tired, and Edward is worry- ing her about his flowers, He doesn't understand any feeling that does not break out in hysterics."" CHAPTER XXYII. "" Come pud esser ch' io non sia piu mio ? Chi m' ha tolto a me stesso, Ch' a me fosse piu presso, O in me potesse piu che non poss' io ? Che cos 'e questo Amore ? "" — Michelagnolo.",matt,,
1050,"I felt as if this avowal were a sort of tacit expression of approval of his want of politeness in her case, and made it awkwardly. I thought at the time, and I knew later on, that she under- stood me, but she pursued her questioning. 'He is not natively impolite, I fancy?' I thought not. Brusque, perhaps, but too kindly to be insolent or ill-bred. ' Shall I introduce you to Mr. Gushing? I must go now, for I see more people coming, and I have to receive them.",matt,,
1055,"By the Very Rev. R. P. Smith, D.D. With Homilies by Rev. Donald Eraser, D.D., Rev. Prof. Chapman, and Rev. B. Dale. Sixth Edition. 15^. 1 Kings. By the Rev. Joseph Hammond, LL.B. With Homilies by the Rev. E. DE Pressens£, D.D., Rev. J. Waite, B.A., Rev. A. Rowland, LL.B., Rev. J. A. Macdonald, and Rev. J. Urquhart.",matt,,
1060,"It was not meant for the eyes of honest men in the direction of Montego Bay, but for those of the robbers among the far hills of Trelawney. "" Jess de sort ob night fo' dem see it,"" mut- tered the myal-man, as with folded arms he stood contemplating the light. "" De sky brack as de Debbil's pitch-pot. Ole Adam, he sure hab some 'un on de look-ont. De sure see 'im soon."" Chakra never looked more hideous than at that moment. Stripped of the ample garment, that to some extent aided in concealing his deformity, a scant shirt, of coarse crimson flannel, alone covering the hunch ; most part of his body naked, exposing to the strong light of the re- flector his black corrugated skin ; the aspect of his ferocious features compressed by the snake-encircled turban upon his temples, the long-bladed knife and pistol appearing in liis waist-belt — all combined to produce a fearful picture, that could not fail to strike terror into whoever should have the misfortune to behold it.",matt,,
