passage.number,passage,annotator,nondomestic,notes
253,"to be mixed up with such a very old- fashioned figure, at the very moment of first showing ourselves ! Will it not be running into danger ? "" "" It is no good to talk about it, Maria,"" he re- plied, with an impatient action of both reins and whip. "" You may depend upon it that there are many fashionable young people, besides ourselves, who have quizzical governors. It is one of the things one must bear, you know, like the toothache, or anything else that can't be helped. It's no good to grumble.",jessica,,
258,"Had it been an appeal to my wife it would have proved your assertion. But he showed it to her in confidence — she lost it — Bennett found it. You, wishing to believe evil, saw evil. That is all.' "" You believe that story ? "" ""I believe it."" ""It must be your interest to do so."" "" Think what you please !",jessica,,
263,"She hurried after him, and called him by his name. * Bill.' Bill turned round sharply ; it was an unusual thing for any one to accost him in the street ; but when he saw that it was Bachel, he was astounded. ' ""Well, I'm curst if it ain't Bachel. I'll be bound ! ' And by way of expressing his amazement^ he stuck his hands deep in his breeches pockets, and fetched his shoulders up about his ears. ' How is father.",jessica,,
268,"Granby was about to express his doubts with considerable warmth, but prudence checked his tongue. Trebeck carelessly proceeded. "" Ay, there she did not judge amiss. Chesterton was worth encouragement. Old Banbury, the father, has thirty thousand a year at least. Mamma had probably drilled her a llittlande and I don't know whether she might not have caught hirn, if she had gone on as prudently as she began ; but she is not sufficiently practised yet."" ""Do you think then,"" said Granby, with suppressed emotion, "" that she is likely to be- come one of your mere establishment-seekers ?"" """,jessica,,
273,"Before the fever broke out, they were often thrown ^' ^ together. together, and she heard, as it was intended she should hear, that their names were very often mingled. Florence Seton, if she could not hear this without a blush — for she was not wholly sorry to hear it — had no cause to blush, for any share that she had had in giving foundation to what was said. She had gone to the work that St. Hilda's offered, without any thought of what might come of it as regarded Crispin ; but she felt that his society did not certainly pre- vent her going on; and then she heard what she had hardly liked to put to herself, his name w4th hers. They sounded very well together. Florence Seton kept to herself her own thoughts; and her manner towards Crispin, was just w hat that of a woman so circumstanced should always be.",jessica,,
278,"Tell Manie I am coming directly, hearie ? "" "" Who gave the child that ridiculous name ? "" asked Louis. * Calalue — anglice, spinach. T 2 "" My gorfaders and gormoders,"" began Calalue. "" Go, go ; massa has not time to hear you now,"" said Stella. "" We must go also, Louis,"" offering her arm, "" for Rebecca never stays long."" As he rose, the remembrance of his bodily infirmity flushed his face.",jessica,,
283,"What I particularly wish to impress upon you is the expediency of confining the future educa- tion of Miss Ella Ashton to the simply useful. It will be most ill-advised to persist in a course of accomplishments totally incompatible with her probable after-position ; and, indeed, all possible competition with her cousins must be carefully avoided. The sooner she is taught to understand the difference in their prospects, the more easily she will become reconciled to what cannot be repaired."" "" It is a sad pity !"" sighed madame, half sorrowfully, and half indignantly ; "" for she is full of talent and enthusiasm."" ""I am sorry to hear it;"" was the hard reply ; "" as neither the one nor the other is Ukely to profit her in the world. Be that as it may, however, you now know my sentiments and feeKngs upon the subject, and you will much oblige me by acting accordingly."" "" It will be a terrible blow to the poor dear child ;"" said the Frenchwoman. """,jessica,,
288,"Of her few faults, perhaps the great- est is that she seldom knows her own mind, where her lovers are concerned, and will blow hot and cold, and merry and sad, and cheerful and petulant, all in one breath as it were. Poor lovers ! they have a hard time of it with her as a rule. But youth is often so, and the cold still years, as they creep on us, with dull common sense and deadly reason in their train, cure us all too soon of our pretty idle follies. Just now she was bent on rebuffing him, but you see her strength failed her, and she spoiled her effect by the smile she mingled with the rebuff'. The smile indeed was so charming, that he remembers nothing but it, and so she not only gains nothing, but loses somethmg to the other side. "" Well, I'll try to mend all that,"" says he, but SO lovingly, and with such unaffected tenderness that she quails beneath his glance.",jessica,,
293,"He was not blind to the soft beauties of Isis, the first time he beheld her, and finding her fa- ther inflexible in virtue, he despaired of possessing her in any way, while such a protector lived ; therefore he had a dou- ble motive for removing Vedova out of his path. It was not likely Isis and her mother could ever be informed of any transactions within the Inquisition, and of course the treachery of Leolfo could not be suspected. His errand was, to feast his eyes once more with the deli, cate charms of Isis, before he fixed his determination. Her father once re- moved, he saw no obstacle to his wishes, and putting on the mask of friendship, he offered his protection to those he had plunged in the bitterest wo. He ap- peared to take a friendly leave, promi- sing to see them on the morrow. As donna Vedova knew not of the part part Leolfo had acted, she did not in- quire of him intelligence of her husband; but the moment Gustavus entered, she read the fatal news in his sunken eye and altered countenance. — """,jessica,,
298,"While he is considering how to reform the drunkards he quite forgets what is to become of the pubHcans. Thousands of them as there are — thousands and thousands."" ** They are much to be pitied. But still, if it is the will of Pro\ddence, they will have eventually to go to the wall."" *^ Providence,"" said Sarah, not irrever- ently, *' must be allowed to do as it pleases. But I do not and cannot see how you find out what that pleasure is till it is made manifest.",jessica,,
303,"Lady Sylvia seemed to be very earnest on this matter. After all, said she, it was the lot of women to suffer. Those who seemed to be most fortunately placed in the world had doubtless their secret cares ; there was nothing for it but to bear them with a brave heart. A wife could not lessen the anxie- ties of her husband by sharing them ; she would more probably increase them by her womanly fear and exaggeration. It was not to be expected that a woman should be constantly intermeddling in affairs of which she could not possibly be a fair judge. A great many wives thought they were neglected, when it was only their excessive vanity that was wounded : that was foolish on the part of those wives. U.s,w, Lady Sylvia talked bravely and gladly.",jessica,,
308,"But his father, of course, will have a voice on this point, which brings me to the strongest reason I have to offer for your coming down here. I know, as well as you do, my dear friend, that your doing any thing for her in the way of giving money (excepting just for a few smart dresses) is perfectly out of the question, — nor do I believe that she expects it. But this may not be equally clear to Colonel Dermont, and when the offer has been made in form, which we are hourly expecting, he will doubtless think it proper to communicate with you. Now it strikes me, that the only means of avoiding such a direct application as must be replied to by a direct answer, will be your coming amongst us in person. And then, you know, nothing can be easier than for you to say, not as a matter of business, but as mere affectionate chit-chat, that if Amelia marries well, and to your satisfaction, you shall ever treat her as your own child ; and so I dare say you will — for were she ten times your child, you could not give her what you have not got. Should the colonel desire you to specify what you will do for her, I shall recommend you to reply that it is not your intention to do any thing during your life, but that you shall take care to do your duty by her in your will. What renders your making this effort exceedingly desirable, is the disagreea- ble fact, that Amelia is so deeply in debt as to render it probable she will be arrested, unless the speedy prospect of a good mar- riage shall set her various creditors at rest, as to their doubts of obtaining payment.",jessica,,
313,"By all means. I can manage to dig, I suppose."" ""I don't know that, but Karl will shew you how ; and meantime, what do you think of this fragment? Quite organ music, is it not Alice?"" "" Ouite,"" said Alice. "" I can't see any tune in it/* said Captain Scudamore. ""Now there's a bad revengeful disposi- tion ! "" exclaimed Maud, "" he is angry with me, and he vents his temper upon poor Spohr.""",jessica,,
318,"But what good would you do, after all? The time has gone by for that sort of thing. I shouldn't like to have on my hands a woman sulking because she was married by force — ^besides, you can't do these mad freaks now — there are too many police-courts about."" ""By force? No!"" the old lady said. "" The giiis I speak of were as glad to run away as the men, I can teU you, and they did it, too, when their relations were against the match."" """,jessica,,
323,"Clara when a child was the darling of the convent, and the delight of the simple inhabitants otthe valley. She had the art of puttinjj every one anniiul her into «rootl liuniour willi h( r and themselves. It seemed as it' every evil passion, and every unpleasant feelinj^ fled at her approach, subdued by her irnioccnt sniile. As she <jjre\v u}), {)erpetual sunshine glowcti upon her brow, and every heart wa?» captivatetl l)y talents that she knew not of, and lovelineNs that was almost yet a secret to her l>osom. The jieasants gazed at her with admiration in her walks, and when she visiteil their coltai;e> thev were charmed with a mixture of kindness and gaiety which was admirably suited to tln.'ir taste. Just at this time a passing cloud was tlis- cernible for the first time upon Clara's radiant fore- head.",jessica,,
328,"' It is well for Geoifrev that he has so staunch a champion,' said the squire, after an ominous pause. He does not seem to be particularly grateful for it.' ' What do vou mean, uncle ?' ' How long is it since he was here?' This question seemed to silence the young girl.",jessica,,
333,"Three Bohemian brothers, a Robin Hood, a Mail Guard, and a Rural Policeman were not a little puzzled at the Great Mogul's empressement. for though they knew him as Captain Doleful, M.C., they had no idea who the gentleman was in the turban and trousers. The red folding-doors now kept flapping like condors' wings, as Highlanders, and archers, and deputy-lieutenants, and Hamlets, and sailors, and Turks, and harlequins, and judges, and fox-hunters, came shouldering and elbowing in with variously-dressed ladies on their arms,—Russians, Prussians, Circassians, Greeks, Swiss, and Chinese—a confusion of countries all speaking one tongue. Captain Doleful was pushed from his place before the doors, and nobody ever thought of asking for him, so intent were they on themselves and each other. “Bless me, is that you?”—“Who'd have thought?”—“Mar, here's James!” “Oh, dear, and William Dobbs!”—“What's your dress?” —“Beautiful, I declare!”—“Your pistols arn't loaded, I hope?”—“Splendid uniform!”",jessica,,
338,"But for this, and the moral cheerfulness imparted by a number of books and papers scattered about the room, it was even less inviting than the generality of Roman lodgings. The Bishop gave his visitor the only arm-chair, and then seated himself, crossed his legs, and smoothed his apron, before he said — *' The matter I wish to speak to you upon, Mr. St. John, is a delicate one. You are, I be- lieve, a cousin of Mrs. Goldwin's V and, I know, are very intimate with her, and also, I believe, with Lord Athelstone ?"" St. John assented by a movement of his head, and the Bishop continued — "" Some time since. Lady Athelstone, for whom I have a great regard, asked me to volunteer some advice to her son. I felt he might justly consider it a great liberty, as I was not — and am not now — upon terms to warrant such in- terference ; and I pointed out to his mother that meddling in young men's private affairs, with- out very grave cause, seldom does any good.",jessica,,
343,"There was one expedient against which I was absolutely determined, disguise. I had experienced so many mortifications and such intolerable restraint when I had formerly had recourse to it, it was associated in my understanding with sensations of such acute anguish, that my mind was thus far entirely convinced: Life was not worth purchasing at so high a price! But, though in this respect I was wholly resolved, there was another point that did not appear to me so material, and in which therefore I was willing to accommodate myself to circumstances. I was contented, if that would insure my peace, to submit to the otherwise unmanly expedient of passing by a different name. But the change of my name, the abruptness with which I removed from place to place, the remoteness and the obscurity which I proposed to myself in the choice of my abode, were all insufficient to elude the sagacity of Jones, or the unrelenting constancy with which Mr. Falkland incited my tormentor to pursue me. Whithersoever I removed myself, it was not long before I had occasion to perceive this detested adversary in my rear.",jessica,,
348,"""But, as you have a curiosity concerning some of these things, I may take the opportunity of adding, that so largely is our English language embued with the French, and especially with the Norman French of the era of the Con- quest; that, as I have been assured by a Norman Frenchman of scholastic turn, if an ordinary Englishman were to pass through the country parts of Normandy, so as to compare the ancient Norman witli the modern English, he could scarcely fail to understand every word that he should hear. And (as, indeed, it ought to have been expected,) it might seem, that the modern or Parisian French, has receded from the Norman dialect, while the modern or English has pre- served it ! He gave me, as an exam])le, the country-Norman pouquette, which is the Eng- lish pocket. The modern French, in the mean time, is poche^ for which the Norman must be jjouque ; and it is from these two words that we receive poke and pouch. As to the ancient diffusion of Norman French over every thing English, except that which even under the Con- quest retained its rusticity, and what is a further proof, that our Latin derivatives have usually come to us through the French, it may be ob- served; not only that the Jlesh of almost all the animals we eat, changes names from the Bri- tish and Anglo-Saxon to the Norman French, as it passes from the fields and farms to the town and table ; but that our very words meat and hutcher are French, and have taken the places of ^r.s7i Rudjlesher, which latter, however, are still used in the northern parts of our island. In this manner, instead of * flesh,' we say ' meat,' which is French ; and, instead of the ' flesh' of a sheep or an ox, 'beef and 'mutton,' which are Freiicli.",jessica,,
353,"Both sides fought desperateh\ The whites knew they must either conquer or die. They gave no quarter and expected none. All but one of them fell. Boss Drummond, whom they had elected captain, escajDed, carrying with him a wounded comrade. Under cover of the nio-ht he brought his friend out of the fight into the Bush, in spite of his own desperate hurts. The Indians were too much mauled to go in search of Drummond, who succeeded in conveying his friend to a hunter's post on the river.",jessica,,
358,"My husband will protect me. If he were here you would not dare "" *' I will wait till he comes, and repeat to him all I have said. Not that I have said much ; not one tithe of what such conduct richly deserves."" "" I think you must be mad, Mr Wriottesley."" ** Do you mean to deny all knowledge of this letter ? "" cried Frank, holding it out and watching her face Intently.",jessica,,
363,"that's to say if God spares her!” “She would not have known it, even if you could have told her this last fortnight,—ever since you went away she's been thinking always that she was a little child at her mother's apron-string. She must have been a happy little thing; it was such a pleasure to her to think about those early days, when she lay old and gray on her death-bed.” “I never knew any one seem more happy all her life long.” “Ay! and how gentle and easy her death was! she thought her mother was near her.”",jessica,,
368,"Their love, their sentiment, their expressions of passion, their pro- fessions of attachment, are all frivolous, heartless, and corrupt. When I was dear to thee,"" said she, trying to smile, "" it was in Italian, in Spanish, in my father's language, thou didst speak to me."" ^* Quarrel not with the French lan- guage,*' said Condulmar: ** it can ex- press love in all its pathos and beauty as well, if not better, than any other ; but in good truth, why should we make miseries for ourselves, seeing that so many are already inflicted upon us? Heaven knows, youth and happiness last not long : why shoukl we, by anxiety and ill-temper, misemploy the one and mar the other ? Love should b^ light, gay, and joyful ; a pleasure and an amusement. By the importance we attach to it, and the violent passions with which we associate it, we make it the most serious of occupations, and the heaviest of cares/' *'",jessica,,
373,"''Emly would make her fortune as a professional singer ; but there, her pa wouldn't like it."" "" Yes I your daughter's voice seems very powerful,"" said Lady Lavinia. ""To be sure it is, and there's more nor one in the parish likes to hear her sing, you may make certain. There's that nice young man, the \acar. Now it do seem a sin and a shame that he don't marry. He is not very well off, to be sure ; but there are nice gals about w^ho could put some- thing into the pot and some fuel under it to set it off a boiling/' and her eyes rested on^'Em'ly."" '' Thank you for your song/' said my stepmother.",jessica,,
378,"So it seems. I am sorry ' — with a cynical lifting of his shoulders, ' to confirm the bad news she has evidently told you, but it is quite true. It appears from a letter of his that I got by this afternoon's post that he has come in for a legacy of two or three thousand pounds. A small thing, but . . . well, it opens out possi- bilities in other lands. Australia is the land, I think ; and he tells me he means to marry Miss Royce and take her out there with him.' * To marry her !' repeats Cecil, as if dazed. '",jessica,,
383,"Possessing too the instincts of a sleuth-hound, no difficulty deterred her in working out a line of cold scent, and even sometimes in throwing her tongue freely when the scent had all but failed. No wonder, then, that, at a tea-party that same night at Buckbury, she hesitated not to announce, but of course confidentially, to a few friends, the private engagement of Frank to Mary Cornish. "" Talk of people being born,"" she said, "" with silver spoons in their mouths ; that girl has found a golden one in hers ! But, oh ! how I should like to be a mouse behind the tapestry at Watercombe, just to hear what Lady Susan, with her proud spirit, says of the affair ! though I don't feel certain that she knows all about it as yet. ' My sweet Mary,' indeed, will be a bitter pill for her when she does, that's certain.""",jessica,,
388,"The boast of mere pretenders to the name. The innocent are gay. COAVPER. JL HE Countess took Matilda and Eli- nor to the Countess of G's ball, agree- able to invitation. There was a gay crowd of fashion assembled, to join in the merry dance. The Chevalier Me- lun was there, and danced with Elinor^ the Baron Longuaville led out Ma- tilda. The Baron was a man of fashion, not only in his dress, his taste in which was generally looked up to, but also in all those acquirements which the licen- tiousness of the age deemed necessary appendages to a man who moved in the higher circles of life, and which we now should justly style libertinism and debauchery.",jessica,,
393,"The young men were brought before the con- suls. When they were accused of plotting to bring back the king, and the letters found by Valerius were read aloud, and the story of the slave Vindicius had been heard, they did not dare to say that they were not guilty. The people were sorry for Brutus when they saw his sons led before hirn to be judged, and some said, — ""Would it not be punishment enough if the young men were banished for all their lives from Rome ? "" Collatinus, the second consul, shed tears, and Valerius did not speak a word. But Brutus looked sternly on his sons. ""Titus and Tiberius,"" he said, ""why do you not answer to the accusation these men bring against you ? "" Three times he asked them this question, but still they did not dare to answer a word, for they knew they were guilty and deserved to be punished. Then Brutus turned to the lictors. """,jessica,,
398,"Now, my young friend, when next you want to hide yourself in a peasant's dress, take the air as well as the garb ; learn something of the patois, and do not speak English to a fair com- panion when there are sharp ears near. Our good friends of the Marais speak httle Enghsh, and when they walk they carry their shoulders round, and their heads somewhat slouching — so — "" and he imitated the air of one of the pea- sants so well, that even Lucette could hardly refrain a smile. ""Besides,"" continued their companion, ""you hinted that you wished to see the Cardinal before you quitted Nantes. Now, putting a good number of facts to those I have first mentioned, it was easy to divine that you were the personage Jacques Beaupre was in search "" True,"" replied Edward, ""and probably I should have taken more care if I had wished to be concealed much longer- — But, as you say, sir, I must, if possible, have the honour of seeing His Eminence the Prime Minister — when do you think I can be so favoured ?"" "" It will be somewhat difficult just now,"" said the other, with a much graver counte- nance than he had hitherto borne, "" the Car- dinal is full of very serious and painful busi- ness, certainly you cannot see him to-night."" "" Then,"" said Edward, in a firm and confi- dent tone, "" we had better retire and seek some good inn, and I can send and crave an audience to-morrow."" "" Nay, you will have to wait close at hand, and snatch your audience when you can get it,"" replied Monsieur de Trouson, adding, laughingly, """,jessica,,
403,"He is to be let out to-day.' ' What do you want with him ? ' ' I'm going to shake hands,' with a quiet smile. ' Shake hands ! ' they both exclaimed, in angry surprise, whilst Paul suggested that the fellow needed a thrashing more than anything, and he would gladly undertake the job. Lovel shook his head. ' No, he has been sufficiently punished ; now's the time to reconcile him with himself.'",jessica,,
408,"would hi vain to attempt jiescribing} for* every word Magliano uttered, had connec- tion Fith the past su£^rings and preseM adversity of the man dearest to her.- She seemed to live again through the peribd in which*, rile had witnessed the efiebt - of wliat^j&be now heard' upon th^ tortured iValombrosa : and no longer did she won-^ der that he shrunk from imparting/even to her, in their last meetings the direful story of a father's crime. , ; But the more she. felt the magnitude €^ his sorrow, the .more fervent becahie her admiration of the generous resolution vdth which he had confined it to his own hreMt.",jessica,,
413,"The highwaymen would much rather have dispensed with her light, as it might be the means of bringing them iuto danger, and yet, when the clear, pure light did break forth and bring into view the country round, they could not help experiencing a sensation of pleasure. They were able to see the ground — the nature of the country through which they were travelling, as well as each other's faces. This was a satisfaction to all. The clouds now gave evideut signs of completely dii- persiug before the slight wind which had sprung up, but the moon waa verging towards the west, and would, ere long, sink beneath the horizon. Suddenly a turn in the lane brought our friends to a spot where two other roads branched off at right angles to each other. Which of these would have been best for them to pursue, onr friends would have found it very difficult to determine, had they not caught sight of a finger-post, with three white, spectral-looking arms, which was planted just where the three roada joined. By the distinctness with which this object was visible in the moonbeams, our friends fancied it had been recently painted. "" Now,"" said Tom King, with satisfaction perceptible io hia tones, ""we shall be able to learn at last where- abouts we are, and where we ought to ao.",jessica,,
