passage.number,passage,annotator,nondomestic,notes
397,"V. 4. which has gone forth from the hps of immutable and everlasting Truth cannot be reversed or annulled, save by the destruction of the body. Thus, also, when it was thought to have in Ame- rica an episcopal, or apostolical, church, never did the people dream of making bishops (and without these there could be no ministry) ; but determined on applying to the Church of England. And our colo- nial establishments are thus preserved in the unity of the Church, under one Head and Lord of all — '* the Shepherd and Bishop of our souls."" But, though the dissenting ministry may not lay claim to the validity which characterizes the mission of our clergy, it may, nevertheless, be argued* from Scripture that it has a validity. The exceeding good- ness and love of our Lord has, it would appear, given a sanction to this sort of co-operating service, by which it is, in his eye, at least suffered, though probably with a regard for his peculiar followers, so jealous that it requires, in order that they may be efficient workmen, a hearty and sincere — not a schismatical and opposing spirit, to render valid the labours of such Christian ministers. One of his apostles came to Jesus, "" saying, Master, we saw one casting out devils in thy name, and he followeth not us : and we forbade him because he followeth not us.""",alex,,
402,"to the man at the helm. “Nor'-west, half north.” “Keep a brisk look-out to the south'ard, sir,” he said to me; “and sing out if you see the sky clearing.” I saw him, by the binnacle-light, put his finger in his mouth and hold it up. But there was no other air to be felt than the short rush first one way, then another, as the ship rolled. Scarcely ten minutes had passed since he addressed me, when I saw what I took to be a ship's light standing clear upon the horizon, right astern. I was about to call out when another light sprang up just above it.",alex,,
407,"There, is, indeed, so little difference between the rich and the poor ; can even Hyde Park in the season go beyond the flower and the cigar ? In certain tropical lands, the first step in civilisation is to buy a mosquito curtain, though your dusky epidermis is as impervious as a crocodile's to the sthig of a mosquito. In this realm of England the first step towards gentility is the two])enny smoke, VOL. I. X to which we ding, though it is made of medi- cated cabbage, though it makes the mouth raw, the tongue sore, the lips cracked, the eyes red, the nerves shaky, and the temper short. Who would not suffer in such a cause ? It bei2fan with a remark of Ano-ela's about his continued laziness.",alex,,
412,"'' Very unHkely."" *' Unlikeher things have occurred. People- have sometimes won a mint of money after losing nearly everything."" "" But after such luck have they not generally lost again ? "" Arthur inquired. *' I own they have ; the ups and downs of fortune are incalculable ; but still, by pursuing a certain system, I think it possible to be absolutely sure of winning in the long run.",alex,,
417,"So they say. We make our for- tunes, and we call them Fate."" ""Yet the Voice sounded — the daughter of the Voice that summoned Samuel."" "" You have told me strange things ; I have heard stranger solved."" "" My faith is a rock."" "" On which you may split."" "" Art thou a Sadducee?"" """,alex,,
422,"Why, there's no end of divarsion--the divarsion of _stopping_ them, of course, I mean (observing a sudden alteration in Loftus's countenance). An' _you_, av coorse, want to stop it? And so, av coorse, do I, my dear. Well, then, wait a bit, now--we must have our eyes open. Don't be in a hurry--let us be harrumless as sarpints, but _wise_ as doves. Now, 'tis a fine thing, no doubt, to put an end to a jewel by active intherfarence, though I have known cases, my dear child, where suppressing a simple jewel has been the cause of half a dozen breaking out afterwards in the same neighbourhood, and on the very same quarrel, d'ye mind--though, of coorse, that's no reason here or there, my dear boy! But take it that a jewel is breaking down and coming to the ground of itself (here a hugely cunning wink), in an aisy, natural, accommodating way, the only effect of intherfarence is to bolster it up, d'ye see, so just considher how things are, my dear.",alex,,
427,"Save five pounds a year and be miserable,"" he said ; "" that sort of saving does more harm than good. There, child, say no more about it ; I'm not going to let you suffer, I've injured you enough already."" "" How can you have injured me ? "" she said, laughing ; *' you are the best father a girl ever had."" He pushed her away as she tried to put her arm round him, and he rose from his chair. ''After all, I had better tell you,"" he said in a hoarse, strange voice, that filled her with fear; ""you'll not caU me the best father in the world, I take it, when you know that I am no better than a thief. Yes, a thief,"" — for she had forced herself to smile at what she considered exagger- ation, — "" I have robbed you of your grand- father's savings, Ruth ; every penny of it is made away with.""",alex,,
432,"I do not see why we should not ; but it is curious to read of one's self and one's neighbours so frankly portrayed,"" said Mr. Dale. "" She has dealt very leniently by us all. She has always some praise to bestow,"" said Mrs. Askham. ""What are you thinking about, George? You look so grave."" "" I was thinking of what has just been read, and of my thorough unconsciousness of the pleasure or pain I caused her."" "" And I dare say, papa, you thought how terrible it must be for her to live in constant fear of betraying herself."" """,alex,,
437,"he will not ; if once you take him, I never more shall see him. Oh, Tom ! Tom ! can you leave your wife in this situ- ation ?' and they rushed into each other's arms. ' It 's very distressing,' said the lieutenant to the midshipman, ' very indeed ; a most un- pleasant service ; and in this case, if we had taken the rest, we might have strained a point and released the shoemaker.' ' Oh ! do, sir, do !' said the woman ; and, as she extended her arms to clasp the officer and bless him, a large pillow dropped from under her dress.",alex,,
442,"Why not ?' * Because — what could you do ?' ' Ah, well, that is exactly what I do not know ; but you might, perhaps, be able to tell me.' ' Oh no, there is nothing. You see, I have good friends.' ' Women — yes.' * Come, now, don't let Gertrude hear you speak in that contemptuous tone about women and their help !' ' Indeed, I had not the faintest notion of the kind. Only there are things in which a man can help a woman better than a woman can.",alex,,
447,"With 145 Figures. Crown Svo, 4J-. 6d. CLAPPERTON, Jaite ^z^w^. — Scientific Meliorism and the Evolution of Happiness. Large crown Svo, Si-. CLARKE, Rev. Henry Ja??ies, A.IT.C.—Tlie Fundamental Science.",alex,,
452,"Were I less affected myself, I should attempt to speak consolation — but 'lis impossible! — the gust of sorrow must have way — aud lime only can reconcile us to our loss. Might I advise you— remain some time longer in India, or make the tour of Europe : it may divert a nielauclioly, which an immediate return to Eugland can only augment, and which would be fruitless lo those who, by the time you receive this, must have been dcad almost a year. ' Mrs. Rivers bequeathed me her estate; which, you know, was in her own power; incumbering it by bearing the name of Belmon' ilso use. I cannot a say I am fond of the change; but the fortune is too consi- derable to be relinquished for a name ; and, as I have expectancy of a title, the alteration will not be material. ' I have nothing lo add, but lo conjure you to bear your misfortune with fortitude —to take the tour I advised ; endeavour lo regain your tranquillity, and you will be a welcome visitant to ■ ' C. BELMONT.' "" The latter part of this letter I did not read till two months after I received it; for I no sooner reached the account of Marias death, than, as struck with lightning, I fell senseless.",alex,,
457,"""I have rarely met,"" he said, ""with any man not in the profession who was so well versed in matters of the kind as yourself. I am very sorry we do not live nearer to each other, as it would give me great pleasure to conduct you over my establishment, and to receive from you any hints as to its arrangements which you might be able to give. You should clearly understand that it is not what is usually termed a lunatic asylum. I receive only twelve ladies or gentlemen whose cases are of the lightest description ; so much so, in fact, that no one who has not gone so deeply as yourself into the subject could detect that there was anything abnormal about them. I do not even call them my patients, I consider them solely as my guests, and treat them as such ; and I assure you a happier little community than we form it would be difficult to meet with."" ""You strongly pique my curiosity,"" I replied. "" I should much like to pay you a visit, and any assistance or advice I could give you would be gladly at your service."" """,alex,,
462,"Your name is ever in my prayers, and that of her whom I have loved as my own sjDiritual child, while I have ever admired in her the model of all Christian virtues. "" May the peace of God descend on you both, and on the darling child heaven has given you. I am greatly in need at the present time of your lordship's advice and opinion on a matter nearly relating to the welfare of your illustrious family ; and the urgency of which makes me tenfold regret your inoj^portune absence. "" Evil-minded and evil-designing persons have set on foot some strange stories re- specting your lordship's honoured brother, Mr. Roger. And the foul calumnies that circulate, like the infection of disease in the very air around us, are the more difficult to put down, from the fact that they are so vague and indefinite, that the cunningest mind can hardly decipher their purport. "" Your lordship will perhaps question my own wisdom in alluding to such idle gossip, when I am not able to give any W^ good explanation of my meaning. And, indeed, I have mused for many weeks on the question before I resolved to come before you with such uncertain tidings, which might reasonably lead you to doubt the saneness of my judgment. But the name of Clifford is too dear to me for me any longer to hold my peace, and I have at length brought myself to the point of writing to you on this painful subject.",alex,,
467,"The rope was taken off and laid on one side. Giving the bridle to one of the men to hold, he approached the horse carefully from the shoulder, and endeavoured (vainly for some time) to put on the saddle ; but it was not until the animal's fore-leg was strapped up that this could be accomplished and firmly secured. The crupper now caused some delay owing to the plunging of the animal ; but all was satisfactorily managed at length, the men all left the yard, and. seating themselves on the top-rail of the stock-yard fence, prepared to enjoy the coming scene with true bush zest. Fitzgerald, after fixing the reins to the saddle, undid the strap which held up the creature's foot, and allowed him to run loose, in order that, if disposed to buck, he might do so before being mounted. But Harlequin, as the grey was named, did not seem inclined to waste his energies on pigskin merely, although he moved about very stiffly, with slightly humped back, and his tail held closely to his body. ""You better mind that fellow, Mr Fitzgerald,"" said the Native ; "" he's sure to buck a docker."" """,alex,,
472,"— I do not pretend that in many things he may not have proved mean, selfish, savage ; — but I know, that of all my acquaintance, there is not one, who, if reared by such a mo- ther, rejected by such a wife, and coaxed into egotism by the flatteries of such a host of toadies, would not have come forth from the furnace, fifty times as hard, as hot, and deteriorated with fifty times as much alloy, as he with whom I spent so many hours of pleasing sadness upon the banks of Lake Leman ; — the man who devoted his blood to the cause of Greece, and who was finally bled to death at Missolonghi. Both of us were in the feverish frame of mind arising from a sense of injury. — Byron's exaltation of spirit showed itself in unnatural mirth, — mine in profound despondency. — But his frantic laughter and my frantic tears sprang from a common source. Would that the bit- terness of Cecil Danby could have qualified the waters of Helicon, to fertilize so fair a field as that which over-shadows with laurels the name and grave of my noble friend ! — But while Byron was plucking the stars from their spheres to form a circlet that might supersede his crown of thorns, a wreath of nettles was the utmost I could hope to accomplish. His ardent soul soared into the majestic altitudes of heaven ; but the sublunary eyes of Cis Danby were evermore riveted upon the waste places of this world.",alex,,
477,"I can't talk about it now. But I'll tell you more as soon as I can. Stay here, my dear boy, at present,"" added Mr. Arlington, kindly, as he noticed traces of suffering on his son's face. ""And study as hard as you like. You can have the chesnut to ride when you like — till she's sold."" Richard came and went as heretofore — but was more reserved than ever. His brother saw, not without additional remorse, that any little increase of brotherly regard and intimacy which had manifested itself at first after Richard's return from Canada had quite vanished.",alex,,
482,"Then,"" added Sir Henry, "" I have heard some ill-na- tured people accuse him of having been the original adviser of the expedition to Wal- cheren. '' "" Then I shall hate him for ever !"" exclaimed Emily, whilst the colour mounted in her face at this expression of Sir Harry : •' if he advised that measure, he can neither be a man of sense or political knowledge !"" '' That is precisely what the world says of him,""' replied the Baronet, unmindful of the tender chord on which he had touched. "" The fact is, it might have been more prudent to have despatched the expedition to the Weser, or still farther north, — where the Prince's ene mies declare the country was ripe for revolt : but then, you know, no man who loves his country, would like to see it become the theatre of war, or exposed to all the incoaveniences and exactions of military occupation; and I think it very natural that he should rather have wished to see a whole British army perish, than that his own country should suffer by the na- tural consequences of war."" "" God deliver me from my friends !'* ex- claimed Sidney. "" I only accused him of being a fool ; you wish to make him out a knave.*' """,alex,,
487,"She had been saving up the money for many, many years, in order to pay for her funeral and also to leave a little behind her. As the withered hands tremblingly shook the coins from their resting-place, her eyes again filled with tears. Between what she had proposed and what had been disposed for her, it was indeed a sad contrast for the poor old thing. ' Take it all,' she said, in her quavering voice. ^ The Lord's will be done. But eh !",alex,,
492,"How very kind of them all,' said Mrs. Arnold, with a mother's pleasure in kindness done to her children ; ' we must have one of the girls here in the summer, if they can spare her ; fortunately, we have a neighbourhood worth seeing, if no other in- ducement. Altogether, the evening was a very happy one, and so much laughing and talking ensued (though for the next two hours Mary and Anna had not a thought but for their new books), that when the elder children went off to bed at nine, Bridget fol- lowing to write in her own room, the silence seemed quite marked. The husband and wife sat over the fire for a few minutes without breaking it ; then Mrs. Arnold said, putting her hand in her husband's — ' It is such a comfort, my love, to see you looking so well again.' ' I ? Oh, yes, as well as possible. And you — how have you got on 1 Frank has not troubled you, I trust ]' '",alex,,
497,"Jorgen Jorgensen s uplifted hand fell to his side, and he was speechless. ''Speak now,"" said the Judge. ''Why- have you brought Michael S unlocks here ? "" Jason stood silent for a moment as if to brace himself up, and then he said, "" I have laid my soul bare to your gaze already, and you know what I am and where I come from."" A low moan seemed to echo him. "" But I, too, am an Icelander, and this is our ancient Mount of Laws, the sacred ground of our fathers and our fathers' fathers for a thousand years."" A deep murmur rose from the vast com- pany.",alex,,
502,"It's a weakness of mine, and that's the way I ruin myself,” said old Joe. “That's your account. If you asked me for another penny, and made it an open question, I'd repent of being so liberal, and knock off half-a-crown.” “And now undo my bundle, Joe,” said the first woman. Joe went down on his knees for the greater convenience of opening it, and having unfastened a great many knots, dragged out a large and heavy roll of some dark stuff. “What do you call this?” said Joe. “Bed-curtains!”",alex,,
507,"The day that it ceased to be placed on the table was a memorable one for a more important reason. As Emma Grove stood beside Jacintha at the head of her class, she drew out her hand- kerchief from her pocket, and with it, unwit- tingly, Jacintha' s vinaigrette, which fell on the floor ! ""What's this?"" cried Jacintha in amaze. Emma, seeing the vinaigrette, coloured like scarlet — then became deadly pale. "" Stand back, young ladies ! "" cried Jacintha. "" You all see what it is ! You all saw where it came from !",alex,,
512,"He could have been lots of good things, only fortune stepped in against everything with a bland smile and said, "" He is a rich man, he is a lord; a lord is a gentleman, a gentleman must not work.' "" There you are, you see, Steyneville, that's my whole life's sum. I had enough good and use in me at the beginning to have made a saint of me, and I had enough bad to have made — well, what I am of me. No medium course ; devil or saint ; saint or devil, that was the question — which was he to be ? Upon my word, Hal, we'd best be walk- ing. Death '11 be ready and the horses im- patient.""",alex,,
517,"If Lady Hauteville received Lord Tralee with politeness, and his son even more kindly, the Marchioness unreservedly detailed her genuine delight at Lionel's visit, which she frankly attributed to herself, and shaking him cordially with both hands, almost before he had time to take off his gloves, M Now do tell me, Fitz, what have you been about for this last century? Let me see — why it is above ten months since I last saw you. — ""What did you do at Paris last winter? — I am told it was very so so."" "" Much as usual: — the French always at- tainable — the English always exclusive — our ambassadress abused by those whom she did not invite, and bored to death by those she did."" "" Did you happen to meet Captain Tiger of the navy there, sir?"" roared out Admiral Gunner, in a voice of thunder.",alex,,
522,"Visitors were arriving every instant, and that part of the square was lively with the voices of the unwashed, who crowded to catch glimpses of the guests, and were kept in rank by two members of the metropo- litan police-force. I was making for the steps, when a voice amidst one half of the crowd on my left exclaimed very rapidly, '' Mr. Neider ! "" and, turning at the moment, I fancied that there was a face amongst the mob of faces that was singularly familiar to me. Still, I was puzzled, and went up the steps and into the hall, before it struck me that it was Sir Richard Freemantle whom I had recognized ; then I hesitated whether to return and speak with him or not. I resolved upon not returning. Sir Richard appeared merely to have mentioned my name aloud in his surprise at seeing me. VOL II. Q",alex,,
527,"""Speak, Syud,"" he said, as they resumed their seats. ""What is it to be?"" "" I need not, my lord,"" replied the Syud. "" What Alia hath put into thy heart I now see in thine eyes, and so be it! Ameen!* ameen ! ameen ! It is his destiny. He is not fit to live; let him die, perjured and faithless as he is.",alex,,
532,"*' Hast fixed on a fitting emissary? Tis a service of some venture, and then your dubbed knight stumbles at any charge but that he makes in full career."" "" Ay, so our chivalry would have the world and each other believe ; but I have never found that the gilt spur on the man's heel indisposed the wearer's head to any act, whatsoever, that his interest recommended and his ability could effect. Canst thou not direct my mind to an emprisor ?"" '* I can,"" replied Moray, drawing up his form, and looking at his brother with an air of action. "" One that will meet ail hazards, and moreover, signally secure to our name the full credit of the exploit.""",alex,,
537,"They were pulling up, at any rate, horrified at the accident; and I soon saw what they were. One, tailing out behind the rest, was a lad that had gone from the hamlet to Dr. Livesey's; the rest were revenue officers, whom he had met by the way, and with whom he had had the intelligence to return at once. Some news of the lugger in Kitt's Hole had found its way to Supervisor Dance, and set him forth that night in our direction, and to that circumstance my mother and I owed our preservation from death. Pew was dead, stone dead. As for my mother, when we had carried her up to the hamlet, a little cold water and salts and that soon brought her back again, and she was none the worse for her terror, though she still continued to deplore the balance of the money. In the meantime the supervisor rode on, as fast as he could, to Kitt's Hole; but his men had to dismount and grope down the dingle, leading, and sometimes supporting, their horses, and in continual fear of ambushes; so it was no great matter for surprise that when they got down to the Hole the lugger was already under way, though still close in. He hailed her.",alex,,
542,"My name is Amanda Ltt- sighi."" — — "" What!"" said the nun, with an air of peculiar interest, ""What! Amanda Lv "" — ""Amanda Lusi<mi,"" ; rejoined her companion; "" let me ask, do you know anybne- of that name?""—"" None,"" replied the sister; "" but yotlr* features much resemble those of a lost and dear friend!"" 1 The sister was much agitated, and rose to got ** I will' said she, f • the harshness of your refusal to the vin->' dictive Abbess, and endeavour to avert the direful conse-' quences of her wrath; in the mean time the door of your' cell shall be left open, that you may visit the turret ; and'",alex,,
547,"4s. 6d. Compensation. A Story of Real Life Thirty Years Ago. Two Volumes. 9s. The Wedding Guests ; or, the Happiness of Life. By Mary C. Hume, Author of The Bridesmaid, Count Stephen, and other Poems.",alex,,
552,"Spenser. *' Bereft of a husband, and a son, my re- maining treasure became doubly endear'd to me. I superintended her education, my- self, and, with transport, beheld her virtues increase with her years and beauty. ''She possessed an understanding very superior to her years; and, while yet a child, would wipe the tears from my cheek, and cheer me with the voice of comfort. To her fiHal entreaties did I render up the last sad vestige of my beloved Neville, which I had treasured as the apple of my eye. She persisted that the sacred relic did but af- ford fuel to my grief; and I, at last, con- sented that it should be deposited in the mausoleum of my forefathers. "" Year upon year revolved, in one dull and insipid uniformity, when, one winter- evening, (such a one that ' I would not have turnd mine enemy s dog into the street' J old Patrick informed me, there was a poor man at the gate, who pressed hard to see me. *^",alex,,
557,"Curly. By John Coleman. Illus- trated by J. C. DOLLMAN. Beyond the Gates. By E, S. Phelps. An Old Maid's Paradise, By E. S. Phelps.",alex,,
562,"i.f. Smith and Hamilton's French Dictionary. 2 vols. Cloth, 2 1 J. : half roan, 125. Snow Flakes, and what they told the Children, beautifiilly printed in colours. Cloth extra, bevelled boards. 5J. Socrates.",alex,,
567,"Think of a prisoner on the very ladder of the gallows-tree, with the rope round his neck, reprieved and pardoned. Think of one doomed to death by his physician receiving the assurance that it was all a mistake, and that he would gather up long years of life as in a sheaf. And think that such joy as these would feel, I felt — and more ! I went to the nearest coffee-shop and ordered bacon, eggs, and tea, offering up a short grace with every plate as it came. And, then, because I felt sure that my old tor- mentor must be dead, I repaired to my lawyers, and saw the clerk. "" Ah,"" he said, '* the poor old man's gone at last ! Went out like the snuff of a candle. His illness was only twenty-four hours.",alex,,
572,"""Do you want to break her heart,"" I exclaimed. ""I am not answerable to any one for what I intend to do,"" said Charlie sullenly. "" Yes, Charlie,"" said I, "" you are answer- able — to one higher than we — to Hew had he been here — even to me. What is this, Charlie? You do not mean it — it is some passing quarrel which a few words will set right."" "" So !"" said Charlie with a sneer. "" Miss Lucy has been complaining to you !"" -",alex,,
