passage.number,passage,annotator,nondomestic,notes
418,""" asked Arthur. "" His brother I believe, but altogether a differ- ent kind of fellow. There is some romance about his history I have heard. I don't know exactly what it is, but I think he married an Italian girl in opposition to his father's wishes, and that she died within a year of the wedding. I should very much like you to know him, he is a highly cul- tured scholar, and a perfect gentleman. Would you like a line or two of introduction to him?"" "" If it is not troubling you too much."" """,jessica,,
423,"To have all will be the common inheritance. Oh ! there will be diflferences : men shall be as unhke then as now : we shall not all desire the same things. You and such as you will desire Art of every kind. You shall have what you desire. In our world, as in this, like will to like.",jessica,,
428,"Percival was impatient and angry. He could not bear in silence the slight cast on his wife. He stormed and grumbled ; he fretted and found fault. He rushed off to the rectory to demand an explanation from Jane, but Jane declined to give him any. He denounced her as havinoj set the neisfhbours a against his wife. She repudiated the charge with indignation and with justice. She had not said a word against Theresa.",jessica,,
433,"We shall have a famous Ball, The Osbornes are certainly coming; you may depend upon that for I was with Ld Osborne this morng—” The party passed on—Mrs E's sattin gown swept along the clean floor of the Ball-room, to the fireplace at the upper end, where one party only were formally seated, while three or four Officers were lounging together, passing in & out from the adjoining card-room. —A very stiff meeting between these near neighbours ensued—& as soon as they were all duely placed again, Emma in the low whisper which became the solemn scene, said to Miss Edwardes, “The gentleman we passed in the passage, was Mr Musgrave, then? —He is reckoned remarkably agreable I understand.—” Miss E. answered hesitatingly—“Yes— he is very much liked by many people. —But we are not very intimate.” —“He is rich, is not he?”—“He has about 8 or 900£ a year I beleive. —He came into possession of it, when he was very young, & my Father & Mother think it has given him rather an unsettled turn.",jessica,,
438,"Then he glanced at the certificate of his baptism two years later, and that of his mother's death. But he refused to look at the certificates connected with his father, the late professor. ' I will have nothing to do with him or his legacy,' he said. ' My one effort will be to forget that he ever existed. But these/ he said, looking towards Mr Walter with so sad a smile, that the lawyer, hopelessly off duty, felt a lump gather in his throat — ' these, if you please, I will keep and be- queath to my children as my most precious possession.' He folded the legal proofs of his mother's wifehood with a reverent touch.",jessica,,
443,"Yes, but she is inconceivably flattered : in fact, she is very plain ; so plain, and with so much vanity, that not having any admirers, she is obliged to circulate fictions of her impru- dences. She desired to be painted as a Magdalen, and she was dreadfully mortified when I told her I did not believe she had any sins of that kind to repent of. This St. Genevieve is the witty Madame de F ; she is handsome, but such a coquette ! I remember her trying to carry off one of my adorers, this divine St. Francois. Poor fellow ! he was ruined by play, and de- stroyed himself: the thought makes me sad whenever I pray to him.",jessica,,
448,"Meanwhile, you remain here ; and circumstances shall guide our future proceedings."" The heart-born pressure of Lord Mowbray's hand was returned in kind by his unhappy friend ; and, yielding a half-satisfied assent, both separated for the night. Not in rest were the faculties of Lord Mowbray absorbed. No — that were ever impossible, when the call of friendship roused them to exertion. Some step, he thought, determinate and imme- diate, must be taken in this affair ; which, in point of fact, wore a more darkened aspect than to his friend he cared to acknowledge. Yet, what was to be done ? — he knew not, though he paused, considered, and weighed the subject again and again.",jessica,,
453,"Go, and take liini with you,' added Sanctis, with a certain harshness in his tone. ' I shall not betray him, but these men, once they see him, will.' ' We had better stay,' urged Este. ' We have both dascrers ; we can do some- thing ' ' There must be nothing of tliat sort,' said Sanctis, with cold indifference. ' If blood were shed, the Inie and cry would be out over the country and the guards here. The men will go when I speak to them.* ' It is the father of Zirlo ! ' said Musa between her teeth. ' I will wait — but go, go, go; — if the men of San Lionardo see you, the carabineers of Telamone will be here to-night.'",jessica,,
458,"There is a certain class of persons — narrow in mind, affectionate in temperament, and pene- trated with vanity — to whom generosity is easy but obligation impossible. When the question is of spontaneous assistance to a superior, there are no bounds to the good they will do, so long as they can peacock themselves with the thought that they have ministered to the god and fed the king's son. But let that god lose his divinity and show himself shorn of his rays — let that king's son be cast down from his throne and thrust into the mud — let divinity and royalty be brought to the base level of the once proud protector, then claim continuance of that former protection — and the scene changes. It is no longer a matter for vanity, for self-gratulation, for self-peacocking. It is not protecting the superior ; it is simply helping the equal — maybe the inferior. The gifts which were tribute become now the doles which are charities, and by this change of character lose their charm. Duty is not so pleasant as free- dom ; and the king's son in rags is not like the king's son in ermine and purple.",jessica,,
463,"Surely on some such spot as this, the poet must have stood when inspired to hymn forth that ecstatic strain of grateful praise — "" Oh Good — oh Great beyond compare, If thus thy meaner works are fair, If thus thy glories gild the span, Of ruined earth and sinful man. How glorious must those mansions be Where thy redeemed shall dwell with Thee !"" I wondered that Milly could so lightly esteem the constant privilege of such a school-room. But she certainly was one who "" cared for none of these things."" I had not long leisure allowed me to indulge in undisturbed contemplation — other footsteps were heard following ours, and two figures came slowly upon us. ""The lady"" and old Lilly — the latter carrying a basJvet on her arm with books and work.",jessica,,
468,"I am so glad I persuaded you to let him go to school."" "" You persuaded me ! Gad, that's good ! Why, it was my idea ! "" Mrs. Harding wisely declined to dispute the point. She smiled pleasantly, and said, '' Ah ! very well,"" glancing at her book again. """,jessica,,
473,"Mrs. Stewart had opened it, and had sent it up. *Here is a message from a friend. Shall I read it?' The blue eyes said ' yes.' They were not dimmed at all, and the nurse admired them immensely. ' Give her our love — Griselda.' Suddenly there was a smile over the patient's face ; it lit up all the features ; it seemed to triumph over pain and over weariness ; it seemed as if she had received the answer to her question, and that the answer had been a certainty — that there was joy somewhere, even for her.",jessica,,
478,"De Mowbray,^' said she, "" have you too agreed with my persecutors, that you constantly constantly fly me? — or do you fear that sorrow is contagious?"" "" Dear Christabelle/' replied he, "" what- ever grief assails you must wound me, and is far more difficult to endure than any that can affect myself."" *' Counsel me then, how to avoid this hated marriage, which, rather than submit to, I would spend my days in a convent, or even face death."" "" Would to Heaven I possessed the power to prevent it, but the unhappy beg- gared orphan de Mowbray, bound by a chain of honour and gratitude to your father, can only with weak and hopeless pity see you sacrificed in silence; while •every pang you endure fixes a corroding thorn in his heart."" '^ De Mowbray,"" said she, ^^",jessica,,
483,"I won't ask her ; but if she knows she will tell me."" "" And what will you do then ?"" said John solemnly. *' Oh, something ! "" said Theo as she shut the door. "" My dear,"" he said to his wife when she was gone, '' I like Theo very much, and I shall be sorry when she goes away, but for her own sake It Is a good thing she's going. Her violent Interest In these Fanes makes me nervous. Did you hear her — ' Am I my sister's keeper?'",jessica,,
488,"Bv Austin Clark, Anthoi of ""A Child of the Menhir,"" &c. Cheaper Edition, post 8vo, picture boards, 2s. ^ Preparing. Clive(Mrs. Archer), Novels by: Post 8vo, illustrated boards, 23. each Paul Ferroll. Wh y Paul Ferroll Killed his Wife Clodd.— Myths and Dreams. By Edward Clodd, F.R.A.S., Author of ""The Story of Creation,"" &c. Cro wn 8vo, cloth extra, 53.",jessica,,
493,"Such at least, it might be, for anything you know to the contrary."" "" O !"" said Skim, *' but he was such a low impudent old rascal. If you had heard him, you would not have disapproved of what we said. Not the slightest offence was meant to you."" "" Indeed!"" *' None upon my honour. If that old ruffian has told you anything, don't believe a word of it. I know him to be a very bad character."" *'",jessica,,
498,"Mr. Luke resettled himself On one side of him was Miss Merton, in a pale blue opera cloak, bordered with white fur, and embroi- dered with gold, something in her large eyes of a subdued sadness ; and on the other side VOL. II. M was Mrs. Sinclair, all in white, who looked like a wood-anemone, against a background of dark foliage. ' Now,' Mr. Luke continued, raising his voice a little, but speaking with a more mellow persuasiveness than usual, ' we all of us feel, in a general way — I think I may say that we nearly all of us feel — that the cul- tured minority of the present age is endowed with feelings, sentiments, and powers of in- sight, not only in advance of its common contemporaries, but in advance of all preced- ing times. We understand natural beauty, and natural affections, and above all moral beauty, in a new way, all our own. Now to what is the advance due ? It is all due to cul- ture in its highest connection — its connection with religion.",jessica,,
503,"""Surely,"" he continued in that strange hoarse voice, "" there should be no such thing as feeling wretched when we are near each other. Whatever may have happened you have the greater part of your life before you. You think you have lived, but I tell you that you have not; you have only vegetated, or suffered, while the healthy joy of hfe should be yours."" His speech terrified her with its sudden vehemence; she looked at him strangely. She thought she had given away all the love she possessed, but was it possible that from the dead branches lopped down to the roots, there could spring fresh shoots, hardier than those which had been destroyed? A strange terror, such as had been more than once subtly communicated to her by the music, was taking possession of her again, as if some black shadow with features which she could not see were crouching behind the visible tempter. She tried to speak, but her lips were dry and stiff.",jessica,,
508,3 vols. THE BISHOPS' BIBLE. By D. Christie Murray and Henry Herman. WITHOUT LOVE OR LICENCE. By Hawley Smart.,jessica,,
513,"""'Twas for him the Mary-le-bone Club passed the rule that the bowling should not be from above the shoulder."" He pronounced the name of the Club conscientiously, syllable by syllable, as if Mary and Lee had been given at baptism to a lady whose surname was Bone. "" Ah, he was a man ! "" he ended impressively. The Httle boy looked up In the old, weatherbeaten, kind face, in open-eyed reverence. It did not seem a strange thing to have a dead father — for he was an orphan himself, and could not at all remember his own father ; but he had an old uncle who supplied the place of father to him — to whom he told all his troubles, and whose sympathy was very perfect and ready. And to have lost such a father as Mr. Slocombe had lost ! What an ex- perience Mr. Slocombe must have had !",jessica,,
518,"He's but a cumberer o' the ground, and he has had his year o' grace, and it's time he was rooted out — for he spreads like a deadly upas-tree, and infects the lift."" ""Hoot,"" answered his wife, unmoved by his rugged eloquence, the while she marked the outer rim of a pie with her deft thumb, and made a wonderful "" mushed "" frill about it. "" Hoot, ye need na' practice your platform cantrips on me. And as for what Sir John did to Mr. Ardwell, I was gey sorry for't, but it wasna' my place to interfere, and I thought if I did it wud only mak' a rumpus, and do little or no good. Do ye think that the lassie's folk would hae let her marry a man that worked for his bread, and played on the organ ? Na ! "" """,jessica,,
523,"He smiled, and murmured under his breath,’ shis is needless;’ then raising his voice, said pleasantly, ‘We shall meet again,’ and passed on. ‘Who is it?’ inquired the artist of Lady May. ‘The Duke of Adullam,’ she answered, wondering in her own mind where they could have known one another. ‘I must have met him somewhere in society,’ said her husband. It was the only time they met abroad. May Glanville was jealous of her husband's fame, and, while they were at Nice expecting Tom Davenant, she began to urge him, somewhat vehemently, to resume his painting. He replied,’ s have no inspiration.",jessica,,
528,"Having no special knowledge on these matters, he was driven to com= parisons; and it flashed across him, that, when he was a boy, and used to make little mud-dams in April, they would resist the tiny stream until it trickled over them, and from that moment then- fate was sealed. Nature, he had observed, operates alike in small things and great, and that sheet of water, though thin as a wafer, alarmed him. i He thought it was better to give a false warning than withhold a true one : he ran to his horse, jumped on him, and spurred away. His horse was fast and powerful, and carried him in three minutes back to Emden's farm. The farmer had gone to bed. Ransome knocked him up, and told him he feared the dam was going; then galloped on to Hatfield Mill.",jessica,,
533,"I put the same question to them now ; I put it, sir, to you, — for, doubtless, you have not been without your share in aiding the count's escape from the room in which he- was confined — I ask you all, where is he concealed, or whither is he gone ? "" "" If they can tell you,"" replied Francis de Langy, "" it is more than I can. I am not, in the least, aware where he is concealed, or whither he is gone. I can safely swear it at this mo- ment. Do you know, Madame d'Artonne ?"" M",jessica,,
538,"He further thought, that having cut his way through them all to the monarch his competitor, he dismounted him, and alighting from his horse, severed his head from his body. Then riding up to him, he thought, "" David !"" said he, with the head upon the point of his sword, still besprinkling his garments with the trick- ling blood, C( I nominate you my gene- ral, and be this my imperial ensign."" Then calling aloud to the dismayed forces of his late enemy, he invited them under his banner, engaging to rule them with equity and moderation; at the same time, declaring to them that he was their rightful sovereign. The troops, David thought, came crowding round him, and did him ho- mage as their lord ; when mounting again upon Slouch, they all marched off B3 together towards Stirling, nigh nnto which place the action had happened. David was now in the height of extasy, not doubting but the people who had so joyfully received his master, would as readily, at his command, conduct him to his principality ; and was just forming his method of behaviour, and the manner in which he should be received by his subjects,- when the acclamations of the troops awakened him, at broad day-light, lonely and deserted, without friend or companion, in a thin part of the wood, where he could cast his eves around him for some distance, between the trees. David was at first dubious, whether the scenes he had before been engaged in were realities, and himself then in a dream when he supposed them vanish- ed -, or whether he had been dreaming before, and was now awake; till rising •k *■»*%/%»■»%-* ■W%/V'»""V from his seat, and performing several of the functions of a wakeful animal, he be- came much dissatisfied, that all the pleasurable prospects before presented to him had been a dream, and that himself and master were rejected Princes still; but the metal he was formed of, and the strength of his ruling passion, ena- bling him to discharge all despondency, he set forward with perseverance, for the recovery of his lost master, patron, and friend. D4 CHAP.",jessica,,
543,"I don't!"" cried Lilith, her cheeks aflame with the recollections of having once told him *' Yon are not one of us!' Tom was in London, and she was not likely to see him till the occasion came. That made it all the worse. With a little conversation, a kiss or two, she might grace- fully have got out of it ; pen and ink made nothing possible but Yea or Nay. She wrote her Yea, and sent it. Had she not said a hundred times that she would do any- thing for Tom ? But her own disinclination to the feast made her exaggerate the horror with which her father would regard it ; and she prepared a fresh difficulty for herself by not telling him at once of Mr. Palmer's invitation, much less of her own acceptance of it.",jessica,,
548,"Leslie looked up in the speaker's face ; there was wildness in the laugh — there was madness lurking in each feature, as he hurriedly pro- ceeded — "" Eut mortal man's hand shall not kill me. Oh ! if I could only rip Nowlan's black heart open, and pour out his traitor blood ! Look in my two eyes — is there blood in them ? Hush! let me speak on.",jessica,,
553,"I'm not exactly a boy of that kidney--to desart my friend in the day of his trouble--devil a bit of it, my darlin'."" ""Well, I am glad to hear you speak as you do,"" she said, with a smile; ""and now, to reward your constancy to him, I tell you that whenever they're settled, or, at all events, out of their troubles, if you think me worth your while, I won't have any objection to become your wife; and--there--what are you about, Fergus? See this, now--you've almost broken the tortoise-shell crooked-comb that she made me a present of."" ""Why, blood alive, Ellen, sure it was only sealin' the bargain I was."" ""But remember it is a bargain, and one I'll stick to. Now leave me; it's gettin' quite dark; or, if you like, you may see me across the fields."" Such, in fact, was the indomitable attachment of this faithful girl to her lovely and affectionate mistress that, with a generosity as unselfish as it was rare, and almost heroic, she never for a moment thought of putting her own happiness or prospects in life in competition with those of the _Cooleen Bawn_.",jessica,,
558,"Even if you detected the immortal bard in an error it would be no business of mine to defend him.' ' I should think not, indeed,' muttered Mr. Erin. ' What I was thinking,' said Margaret, ' was that if you, Willie, or Mr. Talbot (who in- formed us the other night, you know, that he was a poet) had written those lines about spreading her wings over her little brood, it would have been considered plagiarism.' ' What then ? ' inquired Mr. Erin con- temptuously. ' It is the peculiar province of a genius such as Shakespeare's to make every- thing liis own. He improves it by addition.' '",jessica,,
563,"These kind and indefatio;able friends arrang^ed a delightful excursion for me to visit the Penn- sylvania coal district, which we did, a large party of ladies and gentlemen all seated on three little separate engines, which followed each other at a short distance — the three always keeping in sight of one another, and looking very much like toy engines. They were gaily painted on the outside, and covered in with glass roofs and sides. I think I never experienced a more enjoyable sensation than whilst rushing over the country in this tiny vehicle, surrounded by gay and pleasant companions, protected from the intense cold with- out by the comfort that reigned within the little glass abode. We were sitting on the engine it- self, whose blazing fire kept us at a most com- fortable temperature, although all without was a glorious scene of ice and snow ; every tree was frosted, and nothing to be seen for leagues and leagues but that solemn snow-covered land- scape ; relieved by the dark pine-trees and forests of evergreen on the tops of some of the high mountains. Now and then we would come upon a long train — a line of cars they would call it here — humbly drawn up on one side of the road to allow our three little spinning engines to fly past unmolested ; for the telegraph was kept at work incessantly during the two days of our most original excursion, to give warning of our approach, and convey the order from the Directors, who were of our party, to suspend all traffic on the line until we had rushed past. Suddenly would occur a deep bend on the line and a curve which would cause the first engine, our leader, to pass in a parallel line with us, as if retracing its steps many yards below us — that was a pretty sight, as we rushed wildly after each other through this ghostly-looking universe of snow ! Then again we would come to an immense mountain, up whose perpendicular sides our fairy engines had to climb !",jessica,,
568,"To which she replied in the negative; Captain Brisco slept ill, and was much worse in the morning. He had a sore throat, throat, attended with fever and consi- derable pain in the right side — that which had been wounded. His mother sent early for a medical person, who pre- scribed rest, perfect quiet, and proper re- medies. Mrs. Brisco enforced his obe- dience to these directions, and he sub- mitted, requesting, however, to see JVIr. Rokeby when he arrived, and that Cy- rus would pass as much of the day with him as he could. The morning rose serene and pleasant; the sky was clear, and a brilliant sun illumined the lake. Dacre, after he had breakfasted, walked to Ilarrop's, to bid him adieu.",jessica,,
573,"You own then/' said Overbury, ^^ that love has charms 1 And can you have the barbarity to consign that beau- teous flower to the darkness of monastic gloom ? 'Twill fade, father, and pining for the light of liberty will droop its head and die ; but there is no time to lose. Gabriella ! beloved of my soul, fear nought, thine Overbury bids thee a kind farewell ; father adieu. When next we meet, we meet as friends I trust :",jessica,,
578,"HISTORY OF THE ENGLISH REVOLUTION OF 1688. By C. D. Yonge, Regius Professor, Queen's Coll., Belfast. I vol. Crown 8vo. {A^eariy nady. ALEXIS DE TOCQUEVILLE, Correspondence and Conversations with Nassau W. Sk.niok, from 1833 to 1S59.",jessica,,
583,"And then, we look to him as one of our political allies. It would be better that he should know.' * Very well,' she said. ' Tell him what I have just told you.' Her manner of greeting Bellarmin Vv^as very different from the way in which she had welcomed Lord Stonehenge. There was in it none of that frank friendliness. It seemed to Lord Stonehenge that her face, which had been so soft and gentle a minute ago, became suddenly troubled and a little defiant.",jessica,,
588,"“In earnest! How could you think I should jest on such a subject?” He laid his hand on mine that rested on his arm: he must have felt it tremble ... but it was no great matter now. “I hope I have not been too precipitate,” he said, in a serious tone. “You must have known that it was not my way to flatter and talk soft nonsense, or even to speak the admiration that I felt; and that a single word or glance of mine meant more than the honied phrases and fervent protestations of most other men.” I said something about not liking to leave my mother, and doing nothing without her consent.",jessica,,
593,"And such an easy sub- ject, too ! It argues badly for you.' Mrs. Verschoyle has risen in response to his speaking glance. * To our work ! to our work !' cries she gaily. ' Oh ! that 'twere possible/ Carry lingers behind until she can reach Amyot. ' Richie/ says she, ' come here.' ('",jessica,,
598,"More so, my dear lady, a great deal more so, I can assure you. Sometimes she seems to lose all dread and fear of Sir Aldrich ; she quite surprises me, for she will often do things in her childish happiness, that others dare not venture upon. Sir Aldrich is so devoted to her, that he quite forgets to be angry with her, and she can fondle and coax him out of some of his most violent tempers. On the contrary, Harold never permits her to have any freedom of action ; he is cross and very morose to her, laughs at her, and ill-treats her pets, just for the sole pleasure of making the Bulstrode blood boil. He is so extremely proud and haughty, that the child looks upon him as something peculiarly annoying, and never seems to enjoy anything while he is near her. She likewise complains that Sir Aldrich is never so kind when her cousin is with him, as when she has the old gentleman all to herself. '' """,jessica,,
