passage.number,passage,annotator,nondomestic,notes
1220,"I am sure, when I lived with lady Ketterville's niece, who was the rich cheese- cheesemonger's daughter, and who mar- ried the lord mayor's third cousin, who's so 'mensely rich "" "" Hold your tongue !"" said Miss Ash- ton, "" with your nasty butter-and-cheese gentry, faugh ! and your trumpery city honours! You learnt a pretty deal of scandal in mother Netterville's family, I know ! But begone now, and let me read this precious morsel, for which the fool of a writer, whoever he is, has paid so much. However, leave me now to myself"" The moment the soubrette was gone, who. Miss",matt,,
1225,"The delicious audacity with which she came straight to the point, and, in the presence of her mother, proclaimed rather than declared her unaltered feelings towards me, fairly electrified me. "" Dearest Alice ! "" I replied, "" coulcl you for a moment doubt me ? It was for me to fear, — not you. Your value lias undergone no depre- ciation ; while I, always unworthy of you, am, from the alleged stain on my birth, less worthy of you than ever."" "" If that circumstance has actually changed your nature, then you are not that man on whom I bestowed my affection. But if your being has undergone no transformation — and I think not — you are still the same Frank to me."" j During this colloquy, Alice and I had been standing near each other, close to the round table in the middle of the room.",matt,,
1230,"One lie, and a single stroke of the sabre shall send that Sampson poll of yours whizzing through the air."" Pale as death, and shaking like an aspen leaf, the terrified domestic approached, and in as short a time as his gasping would permit, gave all the information desired. But when he came to that part of the narrative, where Frederich had assu- med his name, Konrad could no longer restrain him- self; and, with eyes sparkling with fury, and in a tone which shook the very walls of the Castle, he ordered the guard instantly to conduct the prison- ers back to their cells. "" And by to-morrow,"" he exclaimed, striking the table while he spoke, "" we shall reward the audacious villains with a brace of bullets, for daring to assume our name and dignity. Away with the scoundrels !"" he added, waving his hand ; *' and as for you,"" he continued, addressing Number Nip, ""as you seem the least culpable of all, we shall deal but gently with you; but as a warning to you in future, not to intermeddle with matters that do not belong to you, it is our supreme com- mand that you remain in your dungeon, until the sentence, which we have already passed upon your companions, is put in execution ; after which, some of our people will escort you to the boundaries of the forest, which, as you value your ears, we would not advise you again to pass. Ho, there,"" he con- tinued, on seeing the terrified Johann prostrate on the ground, and who lay in breathless expectation of his condemnation coming next ; "" remove that varlet, and let him be set at liberty. We will not soil our dignity by wasting powder and shot upon such vermin.""",matt,,
1235,"The contraction of the muscle straitens and compresses the blood-vessels, and forces the blood with impetuosity through the heart ; and this squeezing or propelling force gives the fluid an im- petus, that makes it return with violence upon the muscles, in the course of its circulation; then by force and impulse, it stretches the transverse and spiral nervous fibres, and so extends the contracted muscle, that drove it by contraction from itself. Upon this, the blood-vessels having obtained their due extent and capacity, the distending force of the blood of consequence ceases : but the moment it does, the contractive power of the nerves begins to act again, and restores them to a contracted dense state, by a force exactly equal to that which ex- tended them ; till the returning propelled blood re- enters the muscle, and stretches it again, as before described. Such are the two wonderful counter- forces that produce the natural involuntary motion of the heart, and carry on the circulation of the blood. You see with your eyes, in the opened live dog this alternate contraction and extension ; and as the stretching power is but a consequence of the contracting power, contraction is the spring of this wonderful action, in which our will or free agency has no concern. And to what shall we ascribe this astonishing operation, this amazing contractive power, so exactly as to time, and so constantly con- tinued on the muscles of natural or necessary mo- tion; till the aequilibrium by some means or other be broken, and the motion is preternaturally inter- rupted and suspended ? Will the great mechanical reasoners say, that matter does this wonder — matter, that is blind and impotent? Stuff: we must ascribe to a cause wise and powerful, not only the original contrivance of the thing, but the execution of this extraordinary scene.",matt,,
1240,"It was all over and done with, he said, and the land was his, and Harris ought not to have received the money, which he offered to give back to me then and there. When he found that I refused to believe him, or to give up the quittance that Harris had signed on behalf of the firm, he offered to buy the farm for a larger sum than I had just repaid him. It was fully more than the land would have been worth in open market, but I told him plainly that I wish- ed to have no dealings with him, and that Ave had sold the Shropshire property simply that we might not have to break our fenee here. 1 Then he swore that since I would not sell he would make me glad to give, and he brought out what you will find with this. c Copies, you will understand. The originals, he told me, were safe in the hands of his partner.",matt,,
1245,"“And pray what is the collar with the grand order of Jerusalem like?” Mr. Bowker.— “Gold and enamel—enamel and gold, like my lord mayor's.” Mr. Moonface. — “And the order of Jerusalem, what is it like?”",matt,,
1250,"Inglesant's departure from Umbria was so sudden that he had no opportunity of again seeing the stranger whom he had left in the palace, and he was afterwards at some trouble in obtaining any information respecting him. As far as could be ascertained he waited in the palace, according to his promise, until the evening, when, finding that Inglesant did not return, he walked quietly forth, no man hindering him. What his JOHN INGLESANT ; [chap. vn. subsequent fate was is involved in some obscurity ; but it would appear that, having pubhcly insulted the Host in some cathe- dral in the south of Italy, he was arrested by the Holy Office, and thrown into prison, from which there is reason to believe he never emerged. CHAPTER VIII. NOT very long after Inglesant had left for Umbria, his friend, Don Agostino di Chigi, suddenly came to Rome. The Pope's health was rapidly failing, and the excite- ment concerning his successor was becoming intense. The choice was generally considered to lie between the Cardinals Barbarini and di Chigi, though Cardinal Sacchetti was spoken of by some, probably however merely as a substitute, should both the other parties fail in electing their candidate.",matt,,
