passage.number,passage,annotator,nondomestic,notes
1065,"Here he began to weep again, and said, n That the young man's mother was dying with grief, that her time was come, for the an- gel of death had passed over her ; and that if he could but go back and see his mother, he should, after that, return or stay, just as he pleased/' — "" Syroc,"" he continued, "" had quarrelled with his brothers and mother, and in consequence had joined the Nazarenes."" — 94 Thy son,"" cried Brother Roberts, "" has now begun to think of Jesus, and if you take him back into Hindooism, you will be leading him into hell."" 94 I will not compel him to stay, nor even persuade him,"" said Scinghar, "" if he will but go and see his mother."" All his entreaties to this effect were in vain, and at length the old man began to implore that he might himself embrace his boy. These entreaties were as strenuously resisted, and at length the old man fell down in an agony of grief at the door, and a few of his faithful attendants raised him up, and endea- voured to persuade him to rise and go with them. An awful silence reigned throughout the Europeans, and nothing was heard but the faint sobs of the exhausted old man, when suddenly a sigh, and then a deep groan, pro- ceeded from a distant corner of the room, in which sat a short, broad, vulgar figure with coarse features, strongly agitated.",matt,,
1070,"The old ser- vants, who had been in the family for any number of years, could hardly take their eyes off her as they moved about the room ; and Bernard's spirits rose to a most un- clerical height as he observed the favour- able impression she made. As for Phyllida herself, except for an oc- casional glance of affection at her husband, she seemed perfectly unmoved by the silent homage paid her. She neither blushed nor giggled ; no consciousness of her position as a bride made her hurried or nervous. She leant back in her chair as easy and unconstrained In her manners as if she had Hved at Blue Mount all her life. Yet Laura could not help obser\ ing that the pathetic expression she had marked in Miss Moss's countenance had not deserted that of ]\lrs Bernard Freshfield, and that Phyllida still looked more like a lovely martyr than a happy bride.",matt,,
1075,"Come one — come all. Yon rock shall fly From its firm base as soon as I. Lady qf t fie Lake. By its earliest light the Bishop of Toulouse and his train had ridden into the city. Im- mediately on his arrival he hasted to the ca- thedral to celebrate mass ; but as he passed through the aisle, he was struck by the sight of a number of knights, who were ranged like statues on either side, completely armed and with their visors closed ; and who returned slight or rather no obeisance to the bishop, as he marched amid a train of nobles and ecclesiastics towards the altar. Their appear- ance caught the eye of the bishop as he passed on amid ranks of bowing churchmen and kneeling knights craving his benediction, which he dispensed with due solemnity, and then, as he approached the altar, and pre- pared to change his robes for the cere- mony, sent his crosier-bearer to demand of the knights why they assumed such hostile and unwonted guise in the church. The knights answered not a word, and kept their visors down.",matt,,
1080,"“There he goes, Sir! A little bandyer than he was, I think, Sir, aint he? His figure's so far altered, as it seems to me, that you might wheel a rather larger barrow between his legs as he walks, than you could have done conveniently, when we know'd him. There's Sam a coming out, Sir.” “Ah, to be sure!” cried Martin: “Sam, the hostler. I wonder whether that horse of Pecksniff's is alive still?”",matt,,
1085,"D ject, for her conduct has my entire approba- tion. '' "" Insensible brute ! "" muttered Dynley, turn- ing towards the table he had quitted, for a new toothpick. "" To be sure it is not half so bad as old Tadcaster's business ! "" resumed he, recovering his usual confidence. "" No wonder she is off into Essex; — she never could have found cou- rage to see ^",matt,,
1090,"Frank started to his feet ; and catching hold of Captain Hotham's arm, said hurriedly, "" It is Miss Hetherington.""' "" Poor girl !'' cried Hotham, waving off the gathering crowd, "" how came she on deck at such a time ? Merrival, is this your doing V "" Thank God, no, sir. She came on deck in the very restlessness of fear, and I would have taken her down again, when that awful flash — '' "" Which flash, when all were awful V inter- rupted the captain ; "" but this is no time for particulars. Unhappy girl, I believe she has no heart but mine to mourn her loss ; — more fortunate in this than those other victims, whose widows' wailings fill the ship with horror."" "" Other victims ?"" said Frank. "" Yes, yes,"" replied Captain Hotham, shud- dering; ""Mr. Herbert, poor Mant, and a ship- boy dead, and a sailor blinded.",matt,,
1095,"Oh, they 11 let me in ! Will it be next Sunday, Mr. Grieve ? ' * No, the Sunday after. Can I do anything for you?' He came closer to her, seeming to envelope her in his tall, protecting presence. It was impossible for him to ignore her girlish flutter, her evident joy in having seen and talked to him again, in spite of her dread of her father.",matt,,
1100,"Tve no relations, no husband to cater out amusements, and must rely on your gallantry to keep me awake in this dull place, or to give me a sleeping portion, that I may slumber away the heavy hours like the dormouse."" ^' Nay, now you are jesting again, madam, and pleased to laugh at me. You have seen too many tine doings in London, to relish our country sports; besides, who dare gallant a captains lady ; — indeed neither Titus or myself dare venture the undertaking."" "" You reject me, then,"" said she, pre- tending grief. — He bowed saying, "" I've no inclination to be called out, madam."" '^",matt,,
1105,"Laura gave a deep sigh, and covering her face with her hand, burst into tears ; she saw her- self surrounded by people all interested in thwarting her heart's wishes. She had no place of refuge, and she had no one to apply to, for sufficient money to remove her to Cornwall. Whilst brooding over her forlorn state, a letter was brought and handed to her ; it was from Herbert. The old man wrote well — but the direction of this, was in the handwriting of another \ it was the round, legible hand of an attorney's clerk ; and habit had so far mastered the customs of the world, that there were two or three crooked lines, a humble imitation of words, to fill up each line of the direction, as if so many words were absolutely necessary, and no more to com- plete the line; it began, and contained the following information, and was given to Laura, after it had passed the scrutinizing eyes of Lady de Lancy, who considered it some legal matter connected with her visiter's for- tune. "" Honored Madam, "" I write to you in great haste ; he has been here, and I have seen and conversed with him ;— his first inquiries were for you, and I ventured to tell him every thing exactly as it stands ; he staid with me four hours, during which time he wrote down every thing I knew about his father. He then ordered a post chaise and four horses, and went to London ; he is looking uncommon well, and must have had some luck in life, for he was rolling in money, and gave me a very handsome present. He asked how long you were to re- main at Raven Castle, and said, if you wrote down to me by return of post, he would call again before long, as he had some business at Falmouth.",matt,,
1110,"and why drag me into more peril and into danger I am not fit for ? "" ""No words — no more maundering,"" Joel Haggart answered, stamping his foot on the ground, and pouring forth a torrent of oaths. "" By the Lord who made us, if you give me any trouble, you shall rue your folly !"" He added more in a low whisper, the purport of which I could not hear. Perhaps in my vol. I. E anxiety that nothing of the interview should escape me I stept forward, and in so doing disturbed the bushes that afforded me conceal- ment.",matt,,
1115,"Polly, for trying to keep yon well up in one lesson as I've learnt by harder ways than I've tried to learn it to you — a lesson, Polly, as the teachin' of is much neglected in all circles — and that is, the accepting of trouble as a fact, as a thing you must expect to meet anywheres and everywheres, as certainly as a party you might 'appen to owe a small sum to — as take the case of the ^ ketch-'em-ahve-O ' man I borrered six- pence of last June, where could I turn a corner without finding myself stuck to his fly-papers ? But I expected him, Polly, and dodged him as I'd have you expect and dodge trouble, which is as real and sticky as fly-papers, and, no doubt, set by a judicious Providence as knows it wouldn't do for us to be all in the sugar-basin at once."" Polly listened meekly, thankful to hear the old man fall into his habitual preaching tone, to which she was so weU used. But Bardsley, at the first pause he made, became aware of how he had been wasting the few precious moments which remained for him to teach Polly her part in the day's perform- ance. He erected himseK with as much dignity as he could in his lowly position on the floor, and assumed a brisker tone. ""But what I was goin' to say to you, Polly, is, as it's of the most wital import- ance -as you shud rec'lect to-day you are no longer a child, but a growed-up young woman with responsibihties, with more responsibihties — some desirable, others not — than most young women of your age.""",matt,,
1120,"Perfectly ; Aitzig hears perfectly,"" said the factor, at the same time quietly making his way into the room, though the process was not free from difficulties, as the two dogs were pulling him in different directions. "" What is all this about ? "" inquired Kazimir, star- ing with an air of the most supreme disgust from the vulgar and rough-haired brov/n dog to the dazzling white poodle which Aitzig led. "" Are you setting up a caravan, or do you think I am ? "" Aitzig was vastly amused at the notion. The noble captain always did say such amusing things, — always was so witty and agreeable in conversation. Aitzig was truly grateful to see some cheerfulness remaining after so sad a loss; he had feared for the captain's spirits, &c., &c. "" W^hat do you mean ?",matt,,
1125,"In the general sympathy and indignation that the sight of the body of the murdered inspired every other feeling was, for the time being, lost or suspended ; and some signs, some tokens of pity seemed to touch even the hardest heart. Sir John Copplestone was in despair; and in these moments of overwhelming distress he did not hesitate to speak openly even his most secret hopes and plans concerning the deceased. "" I had looked,"" said Copplestone, "" that he should have married my daughter. I would have given her to him, as the dearest thing I had on earth. Would to God she had been his ! But now to see him thus ! I will move heaven and earth to search out his murderer, whoever may have done the deed."" "" Some cursedly cowardly rascal it must have been,"" said Roger Rowle ; "" for look !",matt,,
1130,"I do not know that,"" rejoined Jagellon ; "" I think you can know what is going on in a nation as well in society, or better, than out of it. If society's all right, everything else will get right, I think."" "" I admit what you say,"" said Mr. Mentzel ; "" but there are others who study society. I devote myself to the residuum, as it is called."" '' You mean such men as General Bagrathion look after society ?",matt,,
1135,"How dare you insult this lady!"" '' And how dare you. Sir,"" answered Charles, approaching in a menacing atti- tude, after seducing her from her friends, and from those who loved her, to look .me in the face ? '' "" Madman !'* replied Sir Edward, push^ ing him aside with one hand, while with the other he supported the now almost fainting Elien. "" Gentlemen, I request you will secure him till I place this lady in her carriage, and then 1 am ready to give him any explanation he may wish for/' Some of the gentlemen, who by this time surrounded them, knowing Charles, said to him: *'",matt,,
1140,"Helen blushed as this thought occurred to her, and looked furtively about her, although she was quite alone, just as she had often looked in the old times at school, when she was about to break one of the rules, to pop a harmless note under the lid of Jane Mer- rick's desk or afford surreptitious help to some culprit in durance, because of crimes connected with past participles and '' analyse logique."" He looked very romantic; he was an artist; he had spoken so beautifully about the pictures, of the power and truth with which the great masters rendered the great passions and emotions on their canvases ; he had looked so enthusiastic, for all his English-gentlemanly ease and quiet; she felt sure it must be a love-story. That, had her guess been correct, he should wish to telha love-story to her did not strike Helen as being at all strange ; he had come by such a curious accident to know so much about her that it seemed quite natural. The lucky lady of Mr. Lisle's love must of a surety be beautiful and talented ; perhaps the daughter of some great man, who did not think "" a bit of an artist"" good enough for her, and the poor girl was pining in despair, amid hollow gaiety and surrounded by unmeaning wealth, while he — for even Helen's ignorant simplicity could not be- lieve that there was any pining about Mr. Lisle — confident in the fidelity of the belov- ed one was nobly winning success and fame which should conquer the obstacles that divided them. Helen's imagination had elevated the commonplace specimen of young manhood, who had come across her path so strange- ly, into a modern Quentin Matsys, long before she fell asleep that night. She would keep the secret he was going to con- fide to her ; slie would not mention his name to Mr. or Mrs. Townley Gore; she almost thought she could divine the reason of his prohibition. He said that he had heard of them.",matt,,
1145,"I think the result will be that Mr. Crowbillon will see the force of the foolish step he has taken, and our firm will neither suffer in dignity nor in pocket.” I could not help thinking what a noble gentleman Mr. Perkupp is. His manners and his way of speaking seem to almost thrill one with respect. I said: “Would you like to see the letter before I send it?” Mr. Perkupp said: “Oh no! I had better not. I am supposed to know nothing about it, and I have every confidence in you.",matt,,
1150,"Was he then going to speak more kindly to her now, that he bade her think of those days when they used to be so happy together ? Had she been judging him rashly? Had he not quite forgotten? Was he going to say something to take away the sting of his cold, bitter words before ? But it would not do to tell him how she remembered those days, which he mentioned a little too carelessly even yet. She must not let him know that they made the brightest memory of her life, that she would give all Mr. Fabian's flattery and fine speeches for just one of them VOL. III.",matt,,
1155,"By the time the learned judge had concluded his charge to the jury, the evening was fast closing in. Through- out the whole day, Susan appeared the same penitent creature ; and continued the same modest behaviour as when she first entered the court. Three several times her child was brought to her to be suckled. Many have supposed, that this was planned by some pity- ing friend, to work upon the sympathy of her judges. I am, however, persuaded, that it was entirely in accordance with her own request, and arising from a very different motive. It has been stated, that she looked upon her child, at its birth, with a horror approaching to desperation ; but that, after some time, she became more gentle, and resolved to act the part of a kind mother to it. And, as it was the first and chief witness to her having fallen into a state of deadly sin, to have it as much as possible in her presence, that she might thereby be reminded of the dreadful situation in which she stood both in the eyes of God and man.",matt,,
1160,"for once in her life, over her rival's dis- comfiture.) There was such an air of mysterious reticence about both old ladies when they returned, however, that no one ventured to ask how they had routed the invader. 11 A little mistake/' was all Miss Pru- dence observed, primly crossing her mit- tened hands. "" The young lady felt needless anxiety on the score of how Captain Gascoigne would be taken care of, as she did not know us. That was all And I do not think she will think it necessary to come back again,"" added Miss Patience, with an anciently innocent air, that made Jack grin again, unlucky fellow ! whilst Lee, hiding himself behind Una, Daisy, and a feather-fan, writhed like a gay eel in private ecstasy. Of course tea was now brought in.",matt,,
1165,"Is it Susanna ? ' she asks herself. A LIGHT IN THE WORKSHOP. Susanna enjoyed the teacakes that Mrs. Darkley set down before her with her usual zest, and she was still more delighted with the marks of respect towards the ' heiress ' that accompanied them ; for the knowledge of Susanna's fortune had rapidly made the tour of the place. Bat somehow, when she had done justice to these delicacies, bodily and mental, she began to fidget about the clock in a manner that puzzled Mrs. Darkley, who knew that she had had on more than one previous occasion to give Susanna a hint that it was time to go, before the idea of going was at all accepted by that young lady. She sought to 'amuse her by getting Joshua to teach her to play at draughts ; but Joshua soon gave up the unprofitable attempt.",matt,,
1170,"Yes ! I would have waited till I could sleep with her the sleep of death ; but she lives, thank VOL. II. H God, she lives ! and you tell me in order to change my purpose which has also lived these ten years that she is * faded ! care- worn ! precise ! '",matt,,
1175,"The proprietor is a Frenchman, and a very gentlemanly person, I assure you; the cuisine irreproachable. I remember the old Ste}Tie, wlien ]\ Irs. Fitz-Herbert lived close by, and received all the best people; in the days when the Cockney had not yet taken possession of Briorhthelmstone ; and the Chinese dracrons and pagodas were bright and fresh in the Pa- vilion."" To Brighton therefore the bride and bride- groom departed; Diana attended by a maid, an appanage which the Captain had insisted upon. Poor Diana was sorely puzzled as to what she should find for the maid to do when her hair had been di-essed early in the morning, and her cos- tume laid out in state for the da}'. "" I think I must buy some handkerchiefs for her to hem,"" she said to Gustave; ""it will be quite dreadful for her to have noj^hing to do all day long."" The weather was warm and bright.",matt,,
1180,"I have at length found some employment. In my unfortunate position I must be thankful, and not proud."" "" But business need not occupy you en- tirely,"" she said, as cheerfully as she could; for, young as she was, and unused to con- cealment, her natural refinement and tact led her to wish to hide the interest Sir Charles had excited, and the pleasure she took in his society. "" Are you going quite to forsake us, and at this particular time, too, when my dear father is so ill?"" Seymour was inclined to wish that he could forget what had passed since his first intro. duction to Rosa, or that he could make Rosa herself forget 'that they had ever met. He could not bear to make her unhappy, even for a moment, but the truth must be told, sooner or later.",matt,,
1185,"who is it you seek ?"" "" Peace be with you, my daughter,"" re- plied the monk, ""it is you I seek, and I bear you some tidings of moment. See you this letter ? "" The empress snatched it from his hand, and darted eagerly to the window to catch the last faint light that was in the sky. As soon as her eyes were fixed upon the letter, she exclaimed "" Robert of Gloucester's hand, as I live ! "" Then, as she tore it open, she added, ""Six days — he will be here in six days! — Alas !",matt,,
1190,"By the Rev. C. Maurice, D.D., formerly Fellow of the University of Durham. 1 vol. 8vo, 14.9. Unexplored Syria. By Capt. Burtox, F.E.G.S., and Mr. C. F. Tyrwhitt Drake, F.R.G.S., &c. With a New Map of Svria, Illustrations, Inscriptions, the ' Hamah Stones,' &c. 2 vols. 8vo, 32.'?. "" The work before us is no common book of travels.",matt,,
1195,"How could you have played your cards so well and so succassfully if you had not?"" ""Come, that's not bad--just what I expected, and I like to deal with clever people. Did you put yourself on the whetstone before you came here? I'll go bail you did."" ""If I did not I would have little chance in dealing with your lordship,"" replied Mrs, Lindsay. ""Come, I like that, too;--well said, and nothing but the truth. In fact it will be diamond cut diamond between us--eh?""",matt,,
1200,"But there the resemblance stopped. The elder sister^s constitution was feeble and Isabel's was strong, and other influences besides that of disappointed love had come in, in Margaret's case. The shock had struck at all the delicacies of her nature, and made her sick of the life in which such thoughts could be. And her contemplative nature, her visionary heart had taken refuo;e in heaven. Isabel's trial and her struggle were less — the circumstances were dif- ferent. Instead of the Captain to vociferate against her suitor and reproach her if she looked sad, she had soft, compassionate silence all around her, everybody sympathising with her, no one asking what her sorrow was. Margaret had been sur- rounded by a closer domestic group; first, the Captain, loud and rough and peremptory, inca- pable of comprehending any scruple of her deli- cate mind; then Jean, not yet sufficiently mel- lowed, by love to understand the visionary girl ; and Isabel was still too young, too foolish and heedless to have one sigh of the breaking heart breathed into her bosom.",matt,,
1205,"How long the slumbers of Montesecco lasted was unknown, even to himself. Tired with his long journey, he slept soundly at first, until disturbed by a disagreeable sensation, which, without awaken- ing him, destroyed the comfort of his repose. Oppressed as if by a painful dream, he lay uneasily on his couch of straw, but again and again the same sensation returned, and he moved restlessly from side to side, as though striving with some unseen power. Still he did not awake, until at length, yielding as it were to a sudden and irre- sistible impulse, he started from 'his sleep, and raising himself upon his couch, gazed around him. And there, in the dim moonlight, ere his senses had found their tone, his excited imagination painted innumerable phantoms ; but all bore the same form — the form of his mysterious fellow-travellers. In every glimmer of the moon's pale light through the LIBRARY UNIVERSITY OF ILUNOB crevices of the shed, he fancied that he saw the old man with his long white beard, first horribly dis- tinct, then fading away to a sliadow, and now re- appearing in a form of such magnitude that it seemed to fill up the whole room. Montesecco turned away, but only to meet the shining eyes of the Greek boy, which appeared to flash upon him with superhuman brightness from every corner.",matt,,
1210,"This choice attire was finished by a cheap little shawl, which further exasperated her temper ; and in this frame of mind she was handed by her uncle Ned into the car- riage. As soon as they were fairly off, her uncle, looking ironically at her, said — "" So you don't like to go, Cis ?"" Now Cecil was not ashamed of feeling the dislike, but she was ashamed of saying so ; the colour stole over her face, and she made no reply. a Do you recollect your father ?"" he said to her after a pause. """,matt,,
1215,"'Nay, I have my thoughts that it was because you spied my withered head over the yew tree in Aston churchyard that day when Tubal Bromycham implored of you to give him some definite answer to an oft-urged suit before, that you hastened with your own version of the tale to Sir Thomas Holte. As if I would have betrayed a love-making so much to my mind and so little to his !' 'You are not far wrong, perchance, in your conjec- ture, Maud ; it was a madness, a frenzy, from which fear of my father's displeasure could alone so wonderfully have saved me. But it is long over all, now,' Miss Holte replied, and in tones of deeper emotion than she seemed willing to admit. ' How is it, then, that you will enable me to ascertain my real destiny in a husband, if, as you say, I ever am to wed ?' It is probable Maud herself only projected a humilia- tion and blow to the pride and hopes of the haughty beauty, her enemy's daughter. But she answered boldly, 'Cross my hand with silver thrice, lend me your best laced smock, and the first night the moon is at the full come hither to me, and I will have everything pre- pared for the experiment ; which consists in this, that the fair garment is hung before a fire, magically pre- pared, over a shroud (which I have of mine own, conve- nient, for they would not let my girl wear the shroud I wrought her), and thereupon she that would know her fortune must watch till midnight.",matt,,
